,tinh,project,link,content
72,tai-quang-ninh,Tổ hợp nhà phố thương mại Vincom Shophouse Cẩm Phả,https://cafeland.vn/du-an/to-hop-nha-pho-thuong-mai-vincom-shophouse-cam-pha-2322.html,"[' Vincom Shophouse Cẩm Phả không chỉ kết nối tới các địa điểm trọng yếu trong thành phố như: khu trung tâm hành chính, bệnh viện, trường học, bến cảng, các địa danh du lịch... mà còn rất thuận tiện khi giao thương với các khu vực sầm uất lân cận như: Vân Đồn, Đông Triều, Hạ Long...', ' Quy mô dự án tổ hợp nhà phố thương mại Vincom Shophouse Cẩm Phả', ' ', ' Tổ hợp nhà phố thương mại Vincom Shophouse Cẩm Phả bao gồm 120 căn shophouse,\xa0có tổng diện tích sàn xây dựng từ 257,7 m2 đến 362,1 m2, các căn có diện tích đất từ 75 m2 đến 135,2 m2, số tầng cao là 4 tầng.', ' Với mặt tiền rộng từ 6m đến 8m, phù hợp để phát triển nhiều loại hình kinh doanh như nhà hàng, cửa hàng tiện lợi, thời trang hoặc mở văn phòng đại diện… Trong khi đó, các tầng trên là nơi ở cho cả gia đình, gồm khu vực sinh hoạt chung và không gian riêng cho từng thành viên. Kèm theo đó là trung tâm thương mại Vincom Plaza.', ' ', ' Mặt bằng tổng thể dự án tổ hợp nhà phố thương mại Vincom Shophouse Cẩm Phả', ' Tại Vincom Shophouse Cẩm Phả, cư dân sẽ được tận hưởng một môi trường sống kết hợp hài hòa giữa cảnh quan xanh mát và tiện ích thể thao, vui chơi, giải trí, đa dạng như: TTTM Vincom Plaza, các cửa hàng thời trang, mua sắm, khu ẩm thực, café, rạp chiếu phim, siêu thị Điện máy VinPro, siêu thị VinMart.', ' ', ' Phối cảnh trung tâm thương mại Vincom Plaza', ' ', ' ', ' Phối cảnh dãy nhà phố thương mại shophouse tại dự án tổ hợp nhà phố thương mại Vincom Shophouse Cẩm Phả', ' ', ' Thiết kế chi tiết mẫu shophouse mẫu A1, A2 tại dự án tổ hợp nhà phố thương mại Vincom Shophouse Cẩm Phả', ' ', ' Thiết kế chi tiết mẫu shophouse mẫu B1, B2 tại dự án tổ hợp nhà phố thương mại Vincom Shophouse Cẩm Phả', ' ', ' Thiết kế chi tiết mẫu shophouse mẫu G1, G2 tại dự án tổ hợp nhà phố thương mại Vincom Shophouse Cẩm Phả', ' ', ' Thiết kế chi tiết mẫu shophouse mẫu G3, G4 tại dự án tổ hợp nhà phố thương mại Vincom Shophouse Cẩm Phả', ' Thông tin', ' Ngày 23/11/2018, Công ty Cổ phần Vincom Retail (Tập đoàn Vingroup) chính thức ra mắt tổ hợp nhà phố thương mại Vincom Shophouse Cầm Phả. Dự án được khởi công ngày 08/12/2018 và dự kiến bàn giao quý IV/2019.', ' Giá bán nhà phố thương mại shophouse được tham khảo tại dự án tổ hợp nhà phố thương mại Vincom Shophouse Cẩm Phả từ 4,3 tỷ/căn.', ' Thông tin nhanh dự án tổ hợp nhà phố thương mại Vincom Shophouse', ' Dự án:\xa0Vincom Shophouse Cẩm Phả', ' Vị trí:\xa0Quốc lộ 18, Phường Cẩm Bình, Thành phố Cẩm Phả, tỉnh Quảng Ninh', ' Loại hình: Shophouse', ' Chủ đầu tư: Công ty Cổ phần Vincom Retail (Tập đoàn Vingroup)']"
73,tai-quang-ninh,Tổ hợp khách sạn Eastin Phát Linh Hạ Long,https://cafeland.vn/du-an/to-hop-khach-san-eastin-phat-linh-ha-long-2316.html,"[' Quy mô dự án Eastin Phát Linh', ' ', ' Eastin Phát Linh nằm trong khuôn viên 1.733 m2, diện tích xây dựng là 1.082 m2. Diện tích cây xanh và đường giao thông 651 m2. Tổng diện tích sàn xây dựng 29.913 m2. Mật độ xây dựng 62%.', ' Eastin Phát Linh được thiết kế bao gồm 24 tầng nổi và 2 tầng hầm; Với tổng số 215 căn condotel và 119 phòng khách sạn, các căn hộ được phân bổ từ tầng 6 – 24, mỗi tầng được bố trí 17 căn, với diện tích từ 31,3 m2 – 67 m2. Theo đó, từ tầng 1 – 5 là khu dịch vụ và các tiện ích đi kèm.', ' ', ' Từ Eastin Phát Linh , khách du lịch thuận tiện di chuyển đến những điểm đến thú vị ở Hạ Long như: công viên Sunworld, Hòn Gai, khu du lịch Tuần Châu – Bãi Cháy, Hạ Long Marine Plaza, Marina Bay Beach, rạp chiếu phim CGV, bảo tàng tranh 3D, chợ đêm…', ' Các căn condotel và phòng khách sạn được tích hợp đầy đủ tiện ích như một căn hộ với phòng khách, phòng bếp, không gian sinh hoạt chung và phòng ngủ rộng rãi, tiện nghi.', ' Thông tin', ' Tổ hợp khách sạn Eastin Phát Linh do Công ty Cổ phần Đầu tư Tân Hoa Lư làm chủ đầu tư. Dự án dự kiến sẽ bàn giao và đi vào hoạt động vào quý 2 năm 2020.', ' Công ty Cổ phần Đầu tư Tân Hoa Lư là một trong các nhánh nhỏ được Tập đoàn Phát Linh Group đầu tư ở Hạ Long và các tỉnh thành khác nhằm phát triển các dự án bất động sản.', ' Theo đó, Phát Linh Group được biết đến là tập đoàn hoạt động trong lĩnh vực sản xuất và phân phối với các dòng thép sản xuất, thép xây dựng, cho thuê kho bãi và nhà xưởng tại khu công nghiệp Nam Thăng Long.', ' Công ty Cổ phần xây dựng số 2 (Vinaconex 2) là đơn vị thi công, Coninco là đơn vị tư vấn giám sát dự án tổ hợp khách sạn Eastin Phát Linh.', ' Eastin Phát Linh đã ký kết hợp tác với Absolute Hotel Services Indochina (AHS) - đơn vị quản lý chuyên nghiệp có nhiều kinh nghiệm trong việc điều hành quản lý.', ' Giá bán tham khảo tại dự án tổ hợp khách sạn Eastin Phát Linh từ 1.7 tỷ/căn.', ' Thông tin nhanh dự án Eastin Phát Linh', ' Dự án: Eastin Phát Linh', ' Vị trí: Đại lộ Marine, phường Bãi Cháy, Thành phố Hạ Long, tỉnh Quảng Ninh', ' Loại hình: Condotel', ' Chủ đầu tư: Công ty Cổ phần Đầu tư Tân Hoa Lư']"
74,tai-quang-ninh,Khu đô thị Promexco Móng Cái,https://cafeland.vn/du-an/khu-do-thi-promexco-mong-cai-2268.html,"['Quy mô dự án khu đô thị Promexco Móng Cái', 'https://cafeland.vn/image-data/600-0/static1.cafeland.vn/cafelandData/upload/tintuc/duan/2019/05/tuan-04/pc-promexco-hai-yen-1558972615.jpg?t=1', 'Phối cảnh tổng thể dự án khu đô thị Promexco Móng Cái', 'Khu đô thị Promexco nằm trên khu đất có tổng diện tích khoảng 29ha, mật độ xây dựng hơn 40%, dự kiến cung ứng các lô đất xây nhà liền kề, shophouse, biệt thự và khu trung tâm thương mại.', 'https://cafeland.vn/image-data/600-0/static1.cafeland.vn/cafelandData/upload/tintuc/duan/2019/05/tuan-04/mb-du-an-promexco-mong-cai-1558972646.jpg?t=1', 'Mặt bằng dự án khu đô thị Promexco Móng Cái', 'Cụ thể quy mô dự án gần 600\xa0lô xây nhà liền kề, 100 lô shophouse,50 lô\xa0biệt thự và 3 tòa chung cư cung cấp 870 căn hộ cùng hệ thống tiện ích nội khu.', 'Được biết, giai đoạn 1 dự án phân phối các sản phẩm shophouse với 328 lô có thiết kế 4 tầng 1 tum. Tầng 1 để kinh doanh, tầng 2, tầng 3, tầng 4 dùng để ở, được phép xây đến 90% diện tích đất và mặt tiền rộng 6,5m.', 'https://cafeland.vn/image-data/600-0/static1.cafeland.vn/cafelandData/upload/tintuc/duan/2019/05/tuan-04/pc-day-nha-pho-thuong-mai-du-an-promexco-1558972685.jpg?t=1', 'Phối cảnh dãy nhà phố thương mại dự án khu đô thị Promexco Móng Cái', 'https://cafeland.vn/image-data/600-0/static1.cafeland.vn/cafelandData/upload/tintuc/duan/2019/05/tuan-04/pc-nha-lien-ke-du-an-promexco-1558972715.jpg?t=1', 'Phối cảnh dãy nhà liền kề dự án khu đô thị Promexco Móng Cái', 'Theo quy hoạch, khu đô thị được xây dựng hoàn chỉnh với quy mô là quần thể biệt thự nhà vườn sinh thái kết hợp với trung tâm thương mại, chung cư, nhà ở liền kề và các công trình hạ tầng kỹ thuật khác. Dọc 2 bên tuyến đường trục chính đô thị (tuyến Bắc – Nam mặt cắt 30m; tuyến Đông – Tây mặt cắt 50m) bố trí các công trình hỗn hợp, dịch vụ thương mại kết hợp với nhà phố thương mại (shophouse) tạo trục không gian thương mại, hài hòa.', 'Ngoài ra, hệ thống cây xanh đơn vị ở, cây xanh nhóm nhà ở được bố trí phân tán nhằm tạo cảnh quan cho khu đô thị. Trong khu vực nhà ở thấp tầng tổ chức thành mạng lưới các dải cây xanh gắn kết với nhau và liên kết với hệ thống cây xanh khu vực.', 'https://cafeland.vn/image-data/600-0/static1.cafeland.vn/cafelandData/upload/tintuc/duan/2019/05/tuan-04/pc-thiet-ke-duong-noi-khu-du-an-promexco-1558972738.jpg?t=1', 'Phối cảnh đường nội khu dự án khu đô thị Promexco Móng Cái', 'Sinh sống trong khu đô thị Promexco Móng Cái, cư dân có thể thụ hưởng các tiện ích nội khu gồm 7 công viên cây xanh, 3 tòa hỗn hợp thương mại với siêu thị, phòng tập gym, spa,..cùng bể bơi, thư viện sách, khu vui chơi giải trí,…', 'Thông tin từ CafeLand ', 'Tiền thân do UBND tỉnh Quảng Ninh giao cho Công ty TNHH Hải Phú Ngọc thực hiện đầu tư theo quy hoạch thông qua các Quyết định số 3750/QĐ-UB ngày 22/10/2004 và Quyết định số 5695/QĐ-UBND ngày 29/11/2017.', 'Sau một thời gian hoãn tiến độ triển khai dự án, dự án khu đô thị Promexco được “thay tên đổi chủ” với Công ty CP Sản xuất Bao bì và Hàng xuất khẩu Promexco làm chủ đầu tư.', 'Là một doanh nghiệp Nhà Nước trực thuộc Bộ Thương Mại, Công ty CP Sản xuất Bao bì và Hàng xuất khẩu Promexco ra đời vào ngày 27/12/1973. Hiện doanh nghiệp này sở hữu các lô đất thuộc dự án Rosetown 79 Ngọc Hồi, Promexco Hotel, khu đô thị Hải Yên (Promexco Móng Cái).', 'Dự án được phát triển và phân phối độc quyền bởi Công ty cổ phần đầu tư Thịnh Vượng (TVR Land). Dự án có thời gian khởi công từ quý II/2018 - quý II/2022.', 'Thông tin nhanh dự án khu đô thị Promexco Móng Cái', 'Dự án: Promexco Móng Cái', 'Tổng diện tích:\xa029ha', 'Vị trí: Km5 Quốc lộ 18, phường Hải Yên, TP. Móng Cái, tỉnh Quảng Ninh', 'Tổng vốn đầu tư: ', 'Loại hình: Biệt thự, nhà phố, nhà liền kề, căn hộ, trung tâm thương mại', 'Ngày khởi công: quý II/2018 - quý II/2022', 'Chủ đầu tư: Công ty CP Sản xuất Bao bì và Hàng xuất khẩu Promexco', 'Năm hoàn thành:']"
75,tai-quang-ninh,Khu đô thị Hòa Bình Quảng Ninh,https://cafeland.vn/du-an/khu-do-thi-hoa-binh-quang-ninh-2263.html,"[' Quy mô dự án khu đô thị Hòa Bình Quảng Ninh', ' ', ' Phối cảnh tổng thể khu đô thị đại lộ Hòa Bình', ' Với tổng diện tích đất quy hoạch 48,8ha, diện tích khu đất đấu thầu chiếm gần 45ha, đất khu dân cư hiện trạng chỉnh trang 3,82ha. Cụ thể, đất ở chiếm 142.818m2; đất công trình hỗn hợp 41.266,5m2; đất công trình công cộng 15.725,2m2; đất cây xanh, thể dục thể thao 42.219,8m2; đất giao thông, hạ tầng kỹ thuật 207.757,3m2.', ' Tổng thể khu đô thị đại lộ Hòa Bình cung ứng 631 căn nhà, nhà phố thương mại khoảng 248 căn, nhà ở liền kề là 246 căn và 137 căn biệt thự. Ngoài ra, dự án cũng sẽ dành 20% quỹ đất xây dựng nhà ở xã hội, dự kiến khoảng 28.871,1m2.', ' Tại dự án này, công trình do nhà đầu tư xây dựng thô và hoàn thiện mặt ngoài theo thiết kế được cấp có thẩm quyền phê duyệt gồm 105 căn nhà phố thương mại, cao 5 tầng, mật độ xây dựng 80%, tổng diện tích sàn khoảng 36.952m2; 84 căn biệt thự với quy mô cao 3 tầng, mật độ xây dựng 50%, tổng diện tích sàn khoảng 43.891,2m2.', ' Công trình nhà ở do nhà đầu tư thứ cấp xây dựng theo thiết kế được cấp có thẩm quyền phê duyệt, gồm 143 căn nhà phố thương mại, cao 5 tầng, mật độ xây dựng 80%, tổng diện tích sàn khoảng 61.125,6m2; 179 căn nhà ở liền kề, cao 5 tầng, mật độ xây dựng 80%, tổng diện tích sàn khoảng 81.422,8m2; 53 căn biệt thự, cao 3 tầng, mật độ xây dựng 50%, tổng diện tích sàn khoảng 31.268,9m2.', ' Thông tin từ CafeLand ', ' Với tổng mức đầu tư 1.739 tỉ đồng, trong đó gồm chi phí đầu tư xây dựng 1.410 tỉ đồng, chi phí bồi thường, giải phóng mặt bằng 329 tỉ đồng, liên danh Vinaconex và Phúc Khánh Việt Nam vừa được chỉ định thầu dự án khu đô thị đại lộ Hòa Bình tại TP. Móng Cái, tỉnh Quảng Ninh.', ' Dự kiến thời gian thực hiện dự án kéo dài 36 tháng (từ 2018 – 2020).', ' Thông tin nhanh dự án khu đô thị Hòa Bình Quảng Ninh ', ' Dự án: Khu đô thị Hòa Bình', ' Tổng diện tích: 48,8ha', ' Vị trí: Phường Hải Hòa, TP. Móng Cái, tỉnh Quảng Ninh', ' Tổng vốn đầu tư: 1.739 tỉ đồng', ' Loại hình: Nhà phố, biệt thự, chung cư', ' Ngày khởi công: Năm 2018', ' Chủ đầu tư: Liên danh Vinaconex và Phúc Khánh Việt Nam', ' Năm hoàn thành: Năm 2020']"
76,tai-quang-ninh,Nhà phố thương mại Europe Hạ Long,https://cafeland.vn/du-an/nha-pho-thuong-mai-europe-ha-long-2256.html,"[' Quy mô dự án nhà phố thương mại Europe Hạ Long', ' ', ' Phối cảnh dãy shophouse Europe Hạ Long', ' Được quy hoạch trên khu đất rộng 4,5ha, gồm 3 tiểu khu Silkroad, Élysée và L’Opéra với 16 block mỗi khu, dự án shophouse Europe cung ứng khoảng 328 căn nhà phố nằm chạy dọc trên 850m mặt đường Hạ Long.', ' ', ' Mặt bằng tổng thể dự án shophouse Europe Hạ Long', ' Mỗi căn shophouse được xây dựng trên diện tích đất từ 120 – 237,5m2, thiết kế cao 5 tầng, diện tích sử dụng từ 572 – 1.134m2, phù hợp vừa ở vừa kinh doanh và cho thuê. Cụ thể, shophouse A rộng 120m2; shophouse B có diện tích 122,16m2; shophouse C dao động khoảng 150 – 151.2m2 và shophouse D được xây dựng từ 236,6 – 238.18m2.', ' Sống trong shophouse Europe, những cư dân của dự án vừa được kinh doanh, vừa được giải trí tại khu nhạc nước 1.550m2, khu nhà hát ngoài trời 25.000m2, vườn cảnh quan Ornamental với diện tích 18.000m2,…', ' ', ' Phối cảnh quảng trường trung tâm ngoài trời tại khuôn viên các căn shophouse Europe', ' ', ' Tiến độ thi công các căn shophouse Europe hồi đầu tháng 4/2019 ', ' Thông tin từ CafeLand ', ' Tháng 12/2018, chủ đầu tư là Công ty TNHH Mặt trời Hạ Long (thành viên thuộc tập đoàn Sun Group) giới thiệu ra thị trường phân khu shophouse Europe của quần thể nghỉ dưỡng Sun Plaza Grand World tại Hạ Long.', ' Theo CafeLand tìm hiểu, giá bán mỗi căn nhà phố Europe từ 11 tỉ đồng, giá này đã gồm VAT và xây dựng hoàn thiện.', ' Khởi công từ quý 3/2017, shophouse Europe được dự kiến hoàn thành trong quý 4/2019.', ' Thông tin nhanh dự án shophouse Europe Hạ Long ', ' Dự án: Shophouse Europe', ' Tổng diện tích: 4,5ha', ' Vị trí: Đường Hạ Long, phường Bãi Cháy, TP. Hạ Long, tỉnh Quảng Ninh', ' Tổng vốn đầu tư: ', ' Loại hình: Shophouse', ' Ngày khởi công: Quý 3/2017', ' Chủ đầu tư: Công ty TNHH Mặt trời Hạ Long', ' Năm hoàn thành: Quý 4/2019']"
77,tai-quang-ninh,Khu đô thị Harbor Bay Ha Long,https://cafeland.vn/du-an/khu-do-thi-harbor-bay-ha-long-2242.html,"[' Quy mô dự án khu đô thị Harbor Bay Ha Long', ' ', ' Phối cảnh tổng thể dự án Harbor Bay Ha Long', ' Với quy mô dự án rộng khoảng 13,7ha, Harbor Bay Ha Long được quy hoạch thành khu đô thị có mật độ xây dựng chỉ chiếm 23%, tương ứng diện tích xây dựng 29.574m2, cung ứng 375 căn nhà phố với mặt tiền 6,5m, cao 5 tầng.', ' ', ' Mặt bằng tổng thể dự án Harbor Bay Ha Long', ' Mỗi lô đất được thiết kế thành nhà ở kết hợp kinh doanh với diện tích dao động từ 74,75 – 360,93m2, trong đó diện tích xây dựng 61,75 – 170m2, tổng diện tích sàn 325,7 – 917,75m2. Chủ đầu tư cam kết bàn giao nhà hoàn thiện mặt ngoài, thô bên trong, không có tường ngăn và không bao gồm nội thất.', ' ', ' Mặt bằng tầng 1 mẫu nhà điển hình dự án Harbor Bay Ha Long', ' ', ' Mặt bằng tầng 2, 3, 4 mẫu nhà điển hình dự án Harbor Bay Ha Long', ' Tại khu đô thị Harbor Ha Long, du khách nghỉ dưỡng có thể tận dụng các tiện ích ngoại khu để vui chơi, giải trí, thư giãn như hệ thống bể bơi, khu BBQ, khu vui chơi trẻ em, khu hoạt động thể thao, nhà hàng trên biển, khu ăn uống ngoài trời, gian hàng ki-ot cùng các tiện ích liên khu khác như bãi biển Marina bay, quảng trường biển, tuyến phố đi bộ Marina Square,…', ' ', ' Phối cảnh hồ bơi nội khu dự án Harbor Bay Ha Long', ' ', ' Phối cảnh quảng trường trung tâm khu đô thị Harbor Bay Ha Long', ' Thông tin từ CafeLand ', ' Dưới sự đầu tư từ Tập đoàn BIM Group, mỗi căn nhà phố vừa để ở vừa kết hợp kinh doanh của dự án Harbor Bay Ha Long có mức giá dự kiến từ 5,2 tỉ đồng/căn 12 phòng ngủ.', ' Khu đô thị Halong Marina được đầu tư bởi Công ty Cổ phần Đầu tư Phát triển Syrena Việt Nam (Tập doàn BIM Group). Dự án được bắt đầu triển khai từ năm 2010 với tổng mức vốn đầu tư gần 2 tỉ USD.', ' Dự kiến phân khu Harbor Bay sẽ hoàn thành thi công vào năm 2021.', ' Thông tin nhanh dự án Harbor Bay Ha Long', ' Dự án:\xa0Harbor Bay Ha Long\xa0', ' Tổng diện tích:\xa013,7ha', ' Vị trí:\xa0Bán đảo 2\xa0Hạ Long Marina, phường Bãi Cháy, TP. Hạ Long, tỉnh Quảng Ninh', ' Tổng vốn đầu tư:\xa0', ' Loại hình:\xa0Nhà phố\xa0', ' Ngày khởi công:\xa0', ' Chủ đầu tư:\xa0Tập doàn BIM Group', ' Năm hoàn thành: Năm 2021']"
78,tai-quang-ninh,Biệt thự Pearl Villas Hạ Long,https://cafeland.vn/du-an/biet-thu-pearl-villas-ha-long-2183.html,"[' Quy mô dự án khu biệt thự Pearl Villas Hạ Long', ' ', ' Phối cảnh tổng thể khu biệt thự Pearl Villas Hạ Long', ' Nằm trên khuôn viên đất rộng 2,61ha, Pearl Villas cung ứng 61 căn biệt thự đơn lập, song lập và nhà liền kề. Diện tích mỗi căn biệt thự có diện tích dao động từ 99 – 320m2, diện tích xây dựng từ 252m2 – 417m2, thiết kế cao trung bình 3,5 tầng.', ' ', ' Mặt bằng tổng thể dự án Pearl Villas Hạ Long', ' Trong đó, 9 căn biệt thự đơn lập được thiết kế cao 3 – 4 tầng, với mặt tiền 11 – 20m, diện tích ô đất khoảng từ 178 – 320m2, diện tích xây dựng 289 – 455m2. 38 căn biệt thự song lập nằm trên khu đất có diện tích 157 – 244m2, diện tích xây dựng 289m2, thiết kế cao 4 tầng, mặt tiền từ 10 – 14m. Còn 14 căn nhà liền kề được xây dựng trên diện tích đất 99 – 131m2, diện tích xây dựng từ 270 – 313m2, kết cấu cao 4 tầng, có mặt tiền rộng 6,5 – 8,5m.', ' ', ' Phối cảnh căn biệt thự Pearl Villas điển hình', ' Sinh sống tại khu biệt thự, các chủ nhân Pearl Villas Hạ Long có thể sử dụng các tiện ích xung quanh khu đô thị Halong Marina như tổ hợp thương mại và giải trí Halong Marine Plaza, nhà phố thương mại du lịch Little Vietnam, rạp chiếu phim CGV, câu lạc bộ T – club, chợ đêm,…', ' Thông tin ', ' Công ty TNHH Đầu tư Phát triển Sản xuất Hạ Long (BIM Group) là chủ đầu tư dự án Pearl Villas Hạ Long.', ' Giá bán mỗi căn biệt thự song lập từ 6,5 tỉ đồng/căn (hướng thành phố), 10 tỉ đồng/căn (hướng vịnh).', ' Hiện các căn biệt thự Pearl Villas đã bắt đầu bàn giao cho cư dân từ quý 4 năm ngoái.', ' Thông tin nhanh dự án Pearl Villas Hạ Long', ' Dự án: Pearl Villas Hạ Long', ' Tổng diện tích: 2,61ha', ' Vị trí: Phường Bãi Cháy, TP. Hạ Long, tỉnh Quảng Ninh', ' Tổng vốn đầu tư: ', ' Loại hình: Biệt thự', ' Ngày khởi công:', ' Chủ đầu tư: Công ty TNHH Đầu tư Phát triển Sản xuất Hạ Long (BIM Group)', ' Năm hoàn thành: Quý 4/2018']"
79,tai-quang-ninh,Nhà phố thương mại Loong Toong Quảng Ninh,https://cafeland.vn/du-an/nha-pho-thuong-mai-loong-toong-quang-ninh-2171.html,"[' Quy mô dự án nhà phố thương mại Loong Toong Quảng Ninh', ' ', ' Phối cảnh tổng thể dự án nhà phố thương mại Loong Toong Quảng Ninh', ' Khu nhà ở kết hợp dịch vụ thương mại Loong Toong Quảng Ninh nằm trên khu đất có tổng diện tích 5.837,65m2, dự kiến cung ứng 30 lô đất ra thị trường.', ' ', ' Phối cảnh shophouse\xa0Loong Toong điển hình\xa0', ' Mỗi căn shophouse Loong Toong có diện tích đất từ 58,1 – 100,8m2 với mặt tiền rộng 6m. Các chủ nhân tương lai của căn nhà phố thương mại Loong Toong Quảng Ninh có thể mua nhà để ở, để kinh doanh, cho thuê lại,…với thiết kế tầng 1 là tầng dành cho thương mại – dịch vụ, từ tầng 2 trở lên dành cho không gian sinh hoạt riêng tư của các thành viên trong gia đình.', ' Thông tin ', ' Công ty Cổ phần xe khách Quảng Ninh là chủ đầu tư dự án shophouse Loong Toong Quảng Ninh.', ' Dự kiến khởi công trong tháng 1/2019, các căn shophouse Loong Toong sẽ hoàn thành xây thô bên trong, hoàn thiện bên ngoài vào quý 3/2019.', ' Được biết, mỗi căn shophouse Loong Toong Quảng Ninh có giá bán từ 9 tỉ đồng/căn.', ' Thông tin nhanh dự án nhà phố thương mại Loong Toong Quảng Ninh ', ' Dự án: Shophouse Loong Toong', ' Tổng diện tích:\xa05.837,65m2', ' Vị trí: Mặt đường Quốc lộ 18,\xa0phường Yết Kiêu, TP. Hạ Long, tỉnh Quảng Ninh', ' Tổng vốn đầu tư:\xa0', ' Loại hình: Nhà phố thương mại\xa0', ' Ngày khởi công: Tháng 1/2019', ' Chủ đầu tư:\xa0Công ty Cổ phần xe khách Quảng Ninh', ' Năm hoàn thành: Quý 3/2019']"
