,tinh,project,link,content
53,tai-quang-ninh,"Tổ hợp căn hộ condotel, khách sạn The Holiday Ha Long Quảng Ninh",https://cafeland.vn/du-an/to-hop-can-ho-condotel-khach-san-the-holiday-ha-long-quang-ninh-2938.html,"['Quy mô dự án The Holiday Ha Long Quảng Ninh', 'https://static1.cafeland.vn/cafelandnew/hinh-anh/2021/04/23/144/image-20210423171404-1.jpeg?t=1', 'The Holiday được quy hoạch trên khu đất có tổng diện tích 5.502 m2, với diện tích xây dựng 2.817 m2 (mật độ xây dựng khối đế 68,1%, khối tháp 44,2%). Tổng diện tích sàn xây dựng 76.016 m2.', 'https://static1.cafeland.vn/cafelandnew/hinh-anh/2021/04/23/144/image-20210423171404-2.jpeg?t=1', 'Quy mô dự án gồm 1 tòa tháp cao 39 tầng, 2 tầng hầm và tầng kỹ thuật mái – tum. Từ tầng 1 – 6 dành cho tiện ích thương mại, dịch vụ; tầng 7 dành cho tiện ích chăm sóc sức khỏe; tầng 8 – 39 dành cho căn hộ condotel, phòng khách sạn và tầng mái dành cho cụm tiện ích Sky Resort.', 'https://static1.cafeland.vn/cafelandnew/hinh-anh/2021/04/23/144/image-20210423171404-3.png?t=1', 'Dự án cung cấp ra thị trường 156 phòng khách sạn và 510 căn hộ condotel, có diện tích dao động từ 43,9 – 63,7 m2, bao gồm các loại hình: căn hộ studio, căn hộ 1 – 2 phòng ngủ, căn hộ duplex.', 'https://static1.cafeland.vn/cafelandnew/hinh-anh/2021/04/23/144/image-20210423171404-4.jpeg?t=1', 'Bên trong dự án được đầu tư hệ thống tiện ích nội khu đa dạng gồm: nhà hàng Phượng Hoàng, phòng họp, phòng Pantry, khu trị liệu sức khỏe, bể bơi trẻ em, spa và sân tập yoga,…', 'Từ vị trí dự án, cư dân thuận tiện di chuyển đến các dịch vụ tiện ích ngoại khu như cách Quảng trường Mặt Trời khoảng 450m, Công viên Ha Long Park khoảng 600m, Chợ Vườn Đào khoảng 1,3km, Cảng tàu khách Quốc tế khoảng 1,9km,…', 'Thông tin dự án The Holiday Ha Long Quảng Ninh', 'The Holiday Ha Long do Công ty Cổ phần Khách sạn vịnh Hạ Long làm chủ đầu tư. Công ty Cổ phần Tư vấn Đầu tư và Tài chính Toàn Cầu (Global Invest) là đơn vị phát triển.', 'Công ty Cổ phần Khách sạn vịnh Hạ Long là thành viên của Công ty Cổ phần Du lịch Việt Nam – Hà Nội (VTH), được thành lập vào ngày 13/12/2011. Theo công bố thay đổi thông tin ngày 27/8/2019, doanh nghiệp có vốn điều lệ 120,7 tỉ đồng.', 'Tại đây, ông Nguyễn Bá Tiến (sinh năm 1979) là người nắm chức Chủ tịch HĐQT. Không chỉ vậy, ông Tiến còn được biết đến là Chủ tịch HĐQT của VTH (sở hữu 6,04% cổ phần) và cả Global Invest (sở hữu 85% cổ phần).', 'Theo tìm hiểu, The Holiday Ha Long là dự án Khách sạn, dịch vụ, căn hộ nghỉ dưỡng cao cấp 5 sao vịnh Hạ Long tại phường Bãi Cháy, thành phố Hạ Long, tỉnh Quảng Ninh.', 'Dự án đã được UBND tỉnh Quảng Ninh phê duyệt Quy hoạch tổng mặt bằng tỷ lệ 1/500 tại Quyết định số 4528/QĐ-UBND ngày 5/11/2018. Theo quy hoạch, dự án có tổng diện tích 4.139 m2.', 'Đến ngày 26/2/2019, UBND tỉnh thu hồi 4.139 m2 đất của VTH cho CTCP Khách sạn vịnh Hạ Long tiếp tục thuê theo hình thức thuê đất trả tiền hằng năm để sử dụng vào mục đích xây dựng khách sạn, kinh doanh dịch vụ tại phường Bãi Cháy tại Quyết định số 703/QĐ-UBND.', 'Theo đó, Quyết định nêu rõ thời hạn hoạt động của dự án là 50 năm, nhưng khi chuyển sang Công ty vịnh Hạ Long thời hạn thuê đất thực hiện dự án trên chỉ là 35 năm bởi đất đã được giao từ năm 2004.', 'Được biết, khu đất này được UBND tỉnh Hạ Long cho VTH thuê đất từ năm 2004 tại Quyết định số 957/QĐ-UB. Lúc này VTH là doanh nghiệp 100% vốn nhà nước. Sau khi cổ phần hoá năm 2007, các cổ đông tư nhân tham gia vào VTH thì tới năm 2011 đã hoàn tất xin cấp Giấy CNQSD khu đất nói trên.', 'Ngày 26/4/2019, UBND tỉnh Quảng Ninh có Quyết định chấp thuận CTCP Khách sạn vịnh Hạ Long làm chủ đầu tư dự án.', 'Sau đó, UBND tỉnh tiếp tục điều chỉnh chủ trương đầu tư dự án tại Quyết định số 735/QĐ-UBND ngày 25/3/2020. Theo đó, dự án được điều chỉnh tổng diện tích lên 5.502 m2, trong đó phần diện tích giao thêm 1.363 m2 để làm cây xanh, tiểu cảnh sau đó bàn giao lại cho TP.Hạ Long quản lý.', 'Tổng mức đầu tư dự án là 1.475 tỉ đồng, trong đó 20% vốn của nhà đầu tư và 80% vốn vay và huy động hợp pháp.\xa0Dự án dự kiến khởi công vào tháng 5/2021, hoàn thiện và bàn giao trong quý 4/2022.', 'Giá bán căn hộ dự kiến được tham khảo trên thị trường của dự án The Holiday Ha Long Quảng Ninh từ 1,5 tỉ đồng/căn đầy đủ nội thất đối với dòng căn hộ The Holiday Home, từ 2,1 tỉ đồng/căn đầy đủ nội thất tiêu chuẩn khách sạn.', 'Thông tin nhanh dự án The Holiday Ha Long Quảng Ninh', 'Tổng diện tích:\xa05.502 m2', 'Vị trí: Đường Hạ Long, phường Bãi Cháy, thành phố Hạ Long, tỉnh Quảng Ninh', 'Loại hình: Căn hộ condotel, phòng khách sạn', 'Chủ đầu tư:\xa0Công ty Cổ phần Khách sạn vịnh Hạ Long', 'Đơn vị phát triển:\xa0Công ty Cổ phần Tư vấn Đầu tư và Tài chính Toàn Cầu (Global Invest)']"
54,tai-quang-ninh,Tổ hợp biệt thự khoáng nóng Sun Onsen Village – Limited Edition Quảng Ninh,https://cafeland.vn/du-an/to-hop-biet-thu-khoang-nong-sun-onsen-village-limited-edition-quang-ninh-2903.html,"['Quy mô dự án Sun Onsen Village - Limited Edition Quảng Ninh', 'https://static1.cafeland.vn/cafelandnew/hinh-anh/2021/03/19/144/image-20210319140833-1.jpeg?t=1', 'Sun Onsen Village được quy hoạch trên tổng diện tích 9,06 ha, với 2 phân khu là Yoko Villas và Yama Villas, với tổng số 180 căn biệt thự (gồm tứ lập, song lập, đơn lập) được thiết kế hài hòa giữa kiến trúc đương đại lẫn truyền thống theo phong cách Nhật Bản kết hợp dòng chảy khoáng nóng. Bao gồm: ', 'https://static1.cafeland.vn/cafelandnew/hinh-anh/2021/03/19/144/image-20210319140833-2.jpeg?t=1', 'Mặt bằng phân khu Sun Onsen Village – Limited Edition Quảng Ninh', '124 căn biệt thự tứ lập có diện tích từ 120 – 240 m2, được thiết kế cao 2 tầng, gồm các tiện ích: bể ngâm nóng, phòng xông nóng, lạnh.', 'Mẫu biệt thự tứ lập Sun Onsen Village - Limited Edition Quảng Ninh', '46 căn biệt thự song lập có diện tích từ 210 – 430 m2, gồm tiện ích: bể ngâm nóng, bể ngâm lạnh, phòng xông nóng; ', 'Mẫu biệt thự song lập Sun Onsen Village - Limited Edition Quảng Ninh', '10 căn biệt thự đơn lập có diện tích từ 250 – 1.280 m2, gồm tiện ích: bể ngâm nóng, bể ngâm lạnh, phòng xông nóng, phòng xông lạnh, phòng masage, bể khoáng tại phòng master.', 'Mẫu biệt thự đơn lập Sun Onsen Village - Limited Edition Quảng Ninh', 'Tiện ích nội khu dự án biệt thự Sun Onsen Village bao gồm: Vườn cảnh quan, đường dạo bộ, không gian thiền, chòi nghỉ, club-house,…', 'https://static1.cafeland.vn/cafelandnew/hinh-anh/2021/03/19/144/image-20210319140833-9.jpeg?t=1', 'https://static1.cafeland.vn/cafelandnew/hinh-anh/2021/03/19/144/image-20210319140833-10.jpeg?t=1', 'Ngoài ra, cư dân dự án\xa0còn được thừa hưởng khu\xa0suối khoáng nóng Yoko Onsen Quang Hanh đã được đi vào vận hành.', 'https://static1.cafeland.vn/cafelandnew/hinh-anh/2021/03/19/144/image-20210319140833-11.jpeg?t=1', 'Khu suối khoáng nóng Yoko Onsen Quang Hanh', 'Từ dự án thuận tiện kết nối với các địa điểm, cụ thể như cách TP Hạ Long khoản 18km tương đương 30 phút lái xe, di chuyển đến trung tâm Cẩm Phả 40 phút di chuyển, cách sân bay Vân Đồn khoản 1h phút lái xe.', 'Thông tin dự án Sun Onsen Village - Limited Edition Quảng Ninh', 'Sun Onsen Village do Công ty TNHH Mặt Trời Cẩm Phả làm chủ đầu tư. Công ty Cổ phần Tập đoàn Mặt Trời (Sun Group) là đơn vị phát triển, Sol E&C là đơn vị thi công dự án.', 'Công ty TNHH Mặt Trời Cẩm Phả được thành lập vào ngày 16/3/2018, có trụ sở đặt tại TP.Cẩm Phả (Quảng Ninh). Tính đến tháng 1/2019, doanh nghiệp có vốn điều lệ 525 tỉ đồng do CTCP Dịch vụ Cáp treo Bà Nà góp 64%, Công ty TNHH Mặt trời Phú Quốc góp 30,9% và Nguyễn Chí Thành góp 5%.', 'Được biết, Sun Onsen Village là phân khu biệt thự nằm trong giai đoạn 1 có diện tích 43,6 ha thuộc Khu nghỉ dưỡng suối khoáng nóng cao cấp Quang Hanh (tên thương mại là Yoko Onsen Quang Hanh). ', 'Giai đoạn 1 có tổng mức đầu tư 1.500 tỉ đồng, được khởi công từ tháng 7/2018 đến nay đã đi vào hoạt động phân khu suối khoáng nóng vào tháng 5/2020.', 'Theo chủ trương của tỉnh Quảng Ninh, dự án Khu nghỉ dưỡng khoáng nóng cao cấp Quang Hanh do Công ty TNHH Mặt Trời Cẩm Phả làm chủ đầu tư gồm ba khu, trong đó khu 1 là khu du lịch khoáng nóng cao cấp phục vụ người dân, khu 2 là khu nghỉ dưỡng khoáng nóng cao cấp giáp Vịnh Hạ Long có diện tích 536ha và còn lại là khai thác bảo tồn cảnh quan 150ha. Tổng vốn đầu tư cả hai giai đoạn 3.500 tỉ đồng.', 'Ngày 23/1 vừa qua, Sun Property Group (thành viên của Sun Group) đã cho ra mắt phân khu Yoko Villas, phân khu đầu tiên của dự án Sun Onsen Village – Limited Edition với tổng số 130 căn biệt thự (tứ lập: 86 căn, song lập: 40 căn, đơn lập: 4 căn).', 'Giá bán biệt thự được tham khảo trên thị trường của dự án Sun Onsen Village - Limited Edition từ 17,8 tỉ đồng/căn.', 'Thông tin nhanh dự án Sun Onsen Village - Limited Edition Quảng Ninh', 'Tổng diện tích: 9,1 ha', 'Vị trí: Phường Quang Hanh, thành phố Cẩm Phả, tỉnh Quảng Ninh', 'Loại hình: Biệt thự', 'Chủ đầu tư: Công ty TNHH Mặt Trời Cẩm Phả', 'Đơn vị phát triển: Công ty Cổ phần Tập đoàn Mặt Trời (Sun Group)']"
55,tai-quang-ninh,Căn hộ khách sạn À La Carte Halong Bay Quảng Ninh,https://cafeland.vn/du-an/can-ho-khach-san-a-la-carte-halong-bay-quang-ninh-2884.html,"['Quy mô dự án À La Carte Halong Bay Quảng Ninh', 'https://static1.cafeland.vn/cafelandnew/hinh-anh/2021/02/02/144/image-20210202164954-1.jpeg?t=1', 'À La Carte Halong Bay được quy hoạch trên khu đất rộng 5.125 m2\xa0(mật độ xây dựng 61,41%) với\xa0tổng diện tích sàn 95.000 m2. Dự án có tổng mức đầu tư khoảng\xa01.800 tỉ đồng.', 'Quy mô dự án gồm 1 tòa tháp căn hộ cao 41 tầng và 2 tầng hầm, với cơ cấu chức năng các tầng: tầng 1 – 3 dành cho thương mại dịch vụ và các tiện ích nội khu, tầng 3 trở đi là các căn hộ ở.', 'https://static1.cafeland.vn/cafelandnew/hinh-anh/2021/02/02/144/image-20210202164954-2.jpeg?t=1', 'Dự án cung ứng ra thị trường 411 căn hộ khách sạn (Skybay Suite) có diện tích từ 44 – 253 m2 và 521 căn hộ dịch vụ (Skybay) có diện tích từ 45 – 76 m2. Các căn hộ được thiết kế đa dạng, phù hợp với từng đối tượng khác nhau như căn hộ studio, 2 phòng ngủ, penthouse.', 'https://static1.cafeland.vn/cafelandnew/hinh-anh/2021/02/02/144/image-20210202164954-3.png?t=1', 'Dự án thừa hưởng tiện ích nội khu của toàn bộ quần thể Hạ Long Marina như: trung tâm thương mại, khu vui chơi Tini World, chợ đêm, khu khách sạn 4-5 sao, Công viên Đại Dương,…', 'https://static1.cafeland.vn/cafelandnew/hinh-anh/2021/02/02/144/image-20210202164954-6.png?t=1', 'Quầy bar nằm tại tầng 2 dự án À La Carte Halong Bay', 'https://static1.cafeland.vn/cafelandnew/hinh-anh/2021/02/02/144/image-20210202164954-7.jpeg?t=1', 'Quầy bar nằm trên tầng thượng dự án À La Carte Halong Bay', 'Từ vị trí dự án di chuyển đến Bảo tàng Quảng Ninh, Khu vui chơi giải trí quốc tế Tuần Châu khoảng 4km, Khu vui chơi giải trí Sun World Hạ Long, Sân bay quốc tế Vân Đồn,…', 'Thông tin', 'Dự án À La Carte Halong Bay do Công ty Cổ phần Bất động sản Taseco (Taseco Land) làm chủ đầu tư. Công ty Cổ phần Bất động sản BHS (BHS Group) là đơn vị phát triển dự án. Ricons là đơn vị thi công dự án.', 'Công ty Cổ phần Bất động sản Taseco (Taseco Land) tiền thân là Công ty Cổ phần Đầu tư Bất động sản An Bình, được thành lập vào ngày 29/07/2009, hoạt động chính trong lĩnh vực xây dựng, đầu tư, kinh doanh và phát triển bất động sản.', 'Theo thông tin thay đổi doanh nghiệp vào tháng 9/2020, Taseco Land hoạt động với vốn điều lệ 1.600 tỉ đồng. ', 'Doanh nghiệp hiện đang là chủ đầu tư của nhiều dự án ở Hà Nội như An Bình Complex, Taseco Complex, Phú Mỹ Complex, Khu đô thị mới Nam An Khánh và tại các tỉnh, thành khác.', 'Theo tìm hiểu, đầu năm 2019, Taseco Land đã mua lại khu đất 5.125 m2 thuộc Bán đảo II của Khu đô thị Hạ Long Marina ở Hạ Long để phát triển dự án khách sạn À La Carte Halong Bay với tổng vốn đầu tư dự án khoảng 2.500 tỉ đồng.', 'Giá bán tham khảo trên thị trường của dự án À La Carte Halong Bay từ 42 – 54 triệu đồng/m2 đối với căn hộ dịch vụ, từ 58 – 75 triệu đồng/m2 đối với căn hộ khách sạn.', 'Thông tin nhanh dự án À La Carte Halong Bay Quảng Ninh', 'Tổng diện tích: 5.125 m2', 'Vị trí: Khu đô thị Hạ Long Marina, đường Hoàng Quốc Việt, phường Hùng Thắng, thành phố Hạ Long, tỉnh Quảng Ninh', 'Ngày khởi công: Quý II/2020', 'Chủ đầu tư: Công ty Cổ phần Đầu tư Bất động sản Taseco (Taseco Land)', 'Đơn vị phát triển: Công ty Cổ phần Bất động sản BHS']"
56,tai-quang-ninh,Shophouse Việt Hàn Hạ Long,https://cafeland.vn/du-an/shophouse-viet-han-ha-long-2816.html,"['Quy mô Shophouse Việt Hàn Quảng Ninh', 'https://static1.cafeland.vn/cafelandnew/hinh-anh/2020/10/23/172/image-20201023171914-1.jpeg?t=1', 'Phối cảnh tổng thể Shophouse Việt Hàn', 'Shophouse Việt Hàn có tổng diện tich quy hoạch 1,5 ha, quy mô dự án bao gồm 54 căn nhà phố thương mại với tổng diện tích sàn xây dựng 18.563 m2 và 1 trung tâm thương mại dịch vụ có diện tích 750,8 m2.', 'https://static1.cafeland.vn/cafelandnew/hinh-anh/2020/10/23/172/image-20201023171914-2.png?t=1', 'Sơ đồ thiết kế tổng thể dự án', 'Mỗi căn shophouse tại dự án có thiết kế xây dựng cao 6 tầng + 1 tum, mỗi căn có ít nhất 2 mặt phố. Trong đó tầng trệt được sử dụng để kinh doanh, các tầng còn lại có thể sử dụng để làm văn phòng hoặc làm nơi sinh hoạt cho chủ sở hữu. ', 'https://static1.cafeland.vn/cafelandnew/hinh-anh/2020/10/23/172/image-20201023171914-3.jpeg?t=1', 'Phối cảnh trực diện shophouse tại dự án', 'Shophouse Việt Hàn sở hữu vị trí có 4 mặt tiền đường và các căn nhà phố được thiết kế thông minh, dự án được kì vọng sẽ hỗ trợ cho chủ sở hữu kinh doanh 1 cách thuận lợi với tiềm năng sinh lời cao. Dự án còn có tổ hợp khu nhà hàng, trung tâm thương mại, gym, spa nằm bên trong tổ hợp tiện ích rộng 750,8 m2.', 'Bên cạnh tiền năng sinh lời, dự án còn có các tiện ích ngoại khu phù hợp cho các hộ gia đình kết hợp sinh sống như: cụm trường liên cấp Văn Lang, Bệnh viện Đa khoa quốc tế Vinmec, chợ Hạ Long…', 'Thông tin', 'Chủ đầu tư của khu Shophouse Việt Hàn là Công ty Trách nhiệm hữu hạn Địa ốc Việt Hàn. Dự án được phân phối độc quyền bởi Công ty Cổ phần Bất động sản Newlife Land. ', 'Giá bán shophouse tham khảo trên thị trường của dự án Shophouse Việt Hàn từ 13,38 tỷ đồng/căn.', 'Thông tin nhanh dự án Shophouse Việt Hàn Quảng Ninh', 'Vị trí: Đường 25 tháng 4, phường Hồng Gai, TP. Hạ Long, tỉnh Quảng Ninh', 'Loại hình: Shophouse ', 'Chủ đầu tư: Công ty Trách nhiệm hữu hạn Địa ốc Việt Hàn\xa0 ']"
57,tai-quang-ninh,Chung cư The Ruby Hạ Long,https://cafeland.vn/du-an/chung-cu-the-ruby-ha-long-2815.html,"['Quy mô dự án The Ruby Hạ Long', 'https://static1.cafeland.vn/cafelandnew/hinh-anh/2020/10/23/172/image-20201023144010-9.jpeg?t=1', 'Phối cảnh trực diện The Ruby Hạ Long', 'The Ruby Hạ Long có tổng diện tích quy hoạch 10.490 m2 với mật độ xây dựng 49,9%. Quy mô dự án bao gồm 2 tòa chung cư cao 35 tầng, trong đó có chung 1 tầng hầm và 5 tầng khối đế, còn lại là các tầng căn hộ và khách sạn.', 'https://static1.cafeland.vn/cafelandnew/hinh-anh/2020/10/23/172/image-20201023144011-10.png?t=1', 'Mặt bằng tổng thể dự án The Ruby Hạ Long', 'Sản phẩm của dự án gồm có 1.109 căn hộ chung cư và 130 căn khách sạn. Các căn hộ được thiết kế thành 4 loại: studio, 1 phòng ngủ +1, 2 phòng ngủ +1 và 3 phòng ngủ +1. Mỗi căn có diện tích từ 30 m2 – 98 m2 và 100% căn hộ đều có tầm nhìn về hướng Vịnh Cửa Lục.', 'https://static1.cafeland.vn/cafelandnew/hinh-anh/2020/10/23/172/image-20201023144011-11.jpeg?t=1', 'Sơ đồ mặt bằng tầng căn hộ điển hình', 'Tiện ích nội khu dự án gồm có: bể bơi vô cực, cây ánh sáng, đường dạo massage chân, vườn đọc sách, vườn nướng ngoài trời, bãi đỗ xe, khu tập gym ngoài trời và các khu vực cảnh quan nội khu.', 'https://static1.cafeland.vn/cafelandnew/hinh-anh/2020/10/23/172/image-20201023144011-12.jpeg?t=1', 'Phối cảnh công viên nội khu dự án The Ruby Hạ Long', 'Khu chung cư The Ruby Hạ Long có vị trí tiếp giáp với mặt đường bao biển Trần Thái Tông, cách hầm Cửa Lục 1,5 km. Từ đó cư dân dự án thuận tiện di chuyển đến khu vực trung tâm kinh tế và tài chính của TP. Hạ Long.', 'Thông tin', 'Chủ đầu tư của The Ruby Hạ Long là Công ty Cổ phần Đầu tư sinh thái Đại Dương, dự án được pháp triển bởi Công ty Cổ phần Tổng công ty MBLand (tiền thân là Công ty Cổ phần địa ốc MB). Dự án có đơn vị tư vấn và quản lí bán hàng là Công ty TNHH Phát triển & Kinh Doanh Bất động sản Weland.', 'Khu chung cư The Ruby Hạ Long có tổng vốn đầu tư 1.621 tỷ đồng, dự án nằm tại lô đất KS2 thuộc Khu đô thị\xa0Cao Xanh – Hà Khánh A. Dự án được UBND Quảng Ninh nghiên cứu lập quy hoạch tại văn bản số 2680/UBND/QH1 ngày 23/04/2019. ', 'Ngày 24/10/2019, UBND TP. Hạ Long đã duyệt quy hoạch chi tiết 1/500 đối với dự án The Ruby Hạ Long. Ngoài ra dự án còn được UBND tỉnh Quảng Ninh phê duyệt đầu tư thông qua Quyết định số 595/QĐ-UBND vào ngày 02/03/2020.', 'Giá bán căn hộ dự án The Ruby Hạ Long tham khảo trên thị trường có mức giá từ 27 triệu đồng/m2.', 'Thông tin nhanh dự án The Ruby Hạ Long', 'Dự án: The Ruby Hạ Long ', 'Vị trí: Lô đất KS2, khu đô thị Cao Xanh – Hà Khánh A, TP. Hạ Long, tỉnh Quảng Ninh', 'Loại hình: Căn hộ ', 'Chủ đầu tư: Công ty Cổ phần Đầu tư sinh thái Đại Dương\xa0\xa0 ']"
58,tai-quang-ninh,Dự án Green Bay Premium Hạ Long,https://cafeland.vn/du-an/du-an-green-bay-premium-ha-long-2813.html,"['Quy mô dự án Green Bay Premium Hạ Long', 'https://static1.cafeland.vn/cafelandnew/hinh-anh/2020/10/22/172/image-20201022104703-1.jpeg?t=1', 'Phối cảnh tổng thể dự án Green Bay Premium', 'Green Bay Premium được xây dựng trên tổng diện tích đất 8.150 m2, quy mô dự án bao gồm 2 tháp A và B cao 24 tầng nổi và 1 tầng hầm. ', 'https://static1.cafeland.vn/cafelandnew/hinh-anh/2020/10/22/172/image-20201022104703-2.png?t=1', '\xa0Mặt bằng tầng điển hình từ tầng 3 – 24 ', 'Sản phẩm chính của dự án là 376 căn hộ thương mại với diện tích mỗi căn từ 63 m2 – 177 m2. Mật độ căn hộ mỗi sàn là 16 căn, với 2 tháng máy và 100% căn hộ đều có tầm nhìn hướng biển.', 'https://static1.cafeland.vn/cafelandnew/hinh-anh/2020/10/22/172/image-20201022104703-3.jpeg?t=1', 'Thiết kế căn hộ mẫu loại 2 phòng ngủ ', 'Tiện ích nội khu dự án bao gồm: khu ẩm thực và nhà hàng, hệ thống phòng tập gym và spa, bể bơi... Ngoài ra Green Bay Premium còn được thừa hưởng những tiện ích nội khu khác của dự án khu đô thị Hạ Long Marina.', 'https://static1.cafeland.vn/cafelandnew/hinh-anh/2020/10/22/172/image-20201022104703-4.jpeg?t=1', 'Sơ đồ kết nối đến các khu vực tiện ích ngoại khu của dự án', 'Green Bay Premium có vị trí tại trung tâm khu du lịch Bãi Cháy – Hạ Long, từ dự án cư dân di chuyển đến khu du lịch Tuần Châu - Bãi Cháy chỉ trong 3km, cách trường học Hùng Thắng 1km và các khu tiện ích trong Hạ Long Marina chỉ trong bán kính 700m.', 'Thông tin', 'Green Bay Premium có chủ đầu tư là Công ty Cổ phần Đầu tư Phát triển Syrena Việt Nam, đơn vị thuộc Tập đoàn Bim Group. ', 'Bim Group là một trong những tập đoàn kinh tế tư nhân đa ngành tại Việt Nam, có trụ sở chính tại TP. Hạ Long, tỉnh Quảng Ninh. Tập đoàn được thành lập từ năm 1994, hoạt động chính trong 3 lĩnh vực: bất động sản nghỉ dưỡng, thương mại dịch vụ và nông nghiệp.', 'Green Bay Premium là giai đoạn 2 của Green Bay Village – một phân khu của dự án khu đô thị Hạ Long Marina có tổng vốn đầu tư lên đến 2 tỷ USD. Hiện dự án Green Bay Premium đã hoàn thành, bàn giao và đi vào hoạt động từ năm 2019.', 'Giá bán tham khảo trên thị trường của dự án Green Bay Premium từ 1,28 tỷ/căn.', 'Thông tin nhanh dự án Green Bay Premium Hạ Long', 'Dự án: Green Bay Premium', 'Vị trí: Đường Hoàng Quốc Việt, khu đô thị Hạ Long Marina, phường Hùng Thắng, TP. Hạ Long, tỉnh Quảng Ninh\xa0\xa0\xa0\xa0 ', 'Loại hình: Căn hộ', 'Chủ đầu tư: Công ty Cổ phần Đầu tư Phát triển Syrena Việt Nam']"
