,tinh,project,link,content
27,tai-quang-ninh,Cẩm Đông Ocean Park: Dự án khu đô thị tại tỉnh Quảng Ninh,https://cafeland.vn/du-an/cam-dong-ocean-park-du-an-khu-do-thi-tai-tinh-quang-ninh-3598.html,"['Quy mô dự án Cẩm Đông Ocean Park Quảng Ninh', ' ', 'Dự án Khu đô thị Cẩm Đông Ocean Park có tổng diện tích 52.252 m2; diện tích đất công cộng và cây xanh 1.195 m2; diện tích hạ tầng giao thông 10.057 m2; xây dựng với loại hình đất nền liền kề, biệt thự.', ' ', 'Phối cảnh mặt bằng Khu đô thị Cẩm Đông Ocean Park', 'Dự án Khu đô thị Cẩm Đông Ocean Park có quy mô 60 lô đất liền kề, diện tích từ 100 m2 - 150 m2, mật độ xây dựng 80%, xây dựng tối đa cao 5 tầng; 30 lô đất nền biệt thự diện tích từ 300 m2 - 365 m2, mật độ xây dựng 50%, xây dựng tối đa cao 3 tầng.', ' ', 'Phối cảnh liền kề dự án Khu đô thị Cẩm Đông Ocean Park', 'https://static1.cafeland.vn/cafelandnew/j_NnqdHvJI5t3Laxo1a9zOc2VVQzQSMZPB1Uj4Kg-97knF8zeiaLwVp_22PTUQPnQmV5wS4qE8_NrU2z7p_1u8tYGmSZ-vGnjD4po4pZSdMsVTX0ig2O3z6B9siUMN4gNMxOhJqKUIrD-MgZ-sr6um0', 'Phối cảnh biệt thự dự án Khu đô thị Cẩm Đông Ocean Park', 'Tiện ích nội khu dự án Khu đô thị Cẩm Đông Ocean Park: 1 sân bóng giữa khu đô thị, nhà văn hóa, công viên cây xanh, cách Vincom Plaza và tổ hợp Goldenmark shophouse khoảng 100 m; liên kết đến các trường học, bệnh viện, chợ, cách sân vận động 1,5 km.', ' ', 'Tiện ích ngoại khu dự án Khu đô thị Cẩm Đông Ocean Park: Cách bệnh viện đa khoa Cẩm Phả và chợ Cẩm Thủy 1,5 km; cách sân vận động Cẩm Phả 800 m.', 'Thông tin dự án Cẩm Đông Ocean Park Quảng Ninh', 'Dự án Khu đô thị Cẩm Đông Ocean Park do Công ty TNHH Đông Hà làm chủ đầu tư, có trụ sở chính tại 34A, tổ 5, KP 2, phường Tân Hiệp, thành phố Biên Hoà, tỉnh Đồng Nai.', 'Công ty TNHH Đông Hà thành lập ngày 18/04/2001, do ông Trần Văn Quyền làm người đại diện pháp luật, hoạt động chính trong các lĩnh vực dịch vụ lưu trú ngắn ngày, xây dựng công trình kỹ thuật dân dụng khác, xây dựng nhà các loại, xây dựng công trình đường sắt và đường bộ.', 'Các sản phẩm đất nền tại Khu đô thị Cẩm Đông Ocean Park có giá bán trên thị trường từ 20 triệu đồng/m2.', 'Thông tin nhanh dự án Cẩm Đông Ocean Park Quảng Ninh', 'Dự án: Cẩm Đông Ocean Park\xa0', 'Tổng diện tích: 52.252 m2', 'Vị trí: Đường Vũng Đục, phường Cẩm Đông, thành phố Cẩm Phả, tỉnh Quảng Ninh', 'Tổng vốn đầu tư:\xa0', 'Loại hình: Đất nền', 'Ngày khởi công:\xa0', 'Chủ đầu tư: Công ty TNHH Đông Hà', 'Năm hoàn thành:\xa0', '  Quốc Tấn  ']"
28,tai-quang-ninh,Hạ Long Star: Dự án khu đô thị du lịch sinh thái tại tỉnh Quảng Ninh,https://cafeland.vn/du-an/ha-long-star-du-an-khu-do-thi-du-lich-sinh-thai-tai-tinh-quang-ninh-3593.html,"['Quy mô dự án Hạ Long Star Quảng Ninh', 'https://static1.cafeland.vn/cafelandnew/XKxBuuydbtgLr3M43pOIyqe-5D2vOG7ZHAKQ32TXduxBHLHIoQQBpcbxzkz7TknGHYCKtAYunr_uUAvCVQXtDITecc61i7xkmWGBSG3zcbCPuspjtzOXY6yC6hH1-_brozd7eu4iKdXzoWFmHN3Nhzg', 'Dự án Khu đô thị du lịch sinh thái Hạ Long Star có tổng diện tích 125 ha; phát triển với các loại hình shophouse, nhà phố, nhà vườn, căn hộ; giai đoạn 1 dự án Hạ Long Star xây dựng phân khu The Astro Halong Bay.', 'Dự án Khu đô thị du lịch sinh thái Hạ Long Star có quy mô 250 phòng khách sạn 5 sao, 100 phòng khách sạn cao cấp, 226 biệt thự, 85 nhà phố, 114 căn hộ và trung tâm thương mại. Các sản phẩm shophouse, nhà phố diện tích từ 95 m2 - 120 m2, xây dựng cao 5 tầng 2 mặt tiền.', 'Phân khu The Astro Halong Bay tại dự án Hạ Long Star có diện tích 12 ha, gồm 4 tiểu khu: Caring Valley, Mensa Parkway, Lepus Central, Orion Avenue. Phân khu The Astro Halong Bay tại dự án Hạ Long Star có quy mô 363 lô, mật độ xây dựng 40%, các sản phẩm trong phân khu được xây dựng cao 5 tầng.', 'https://static1.cafeland.vn/cafelandnew/MShs-Cz34hkqySsHCGz8jfnVRm2KHpUzrB2_FeYx9xH8ZiE60sRYgrFgZhlVXBZZHbmMVeO_2LRRYxfG4iVLTJUvEjfbU0gNYq_qzr-zJ0QgwqTY9MfEC2FCGMfa76J5vC1MMN_EZQVzOmpL3FMCY6c', 'Tiện ích nội khu dự án Khu đô thị du lịch sinh thái Hạ Long Star: Bể bơi vô cực, bể bơi 4 mùa, khu trung tâm thể thao, vui chơi giải trí phức hợp, nhà hàng, khách sạn, trường mầm non tiêu chuẩn, khu văn phòng, sky Bar, khu sinh hoạt cộng đồng.', 'https://static1.cafeland.vn/cafelandnew/OGiv4-6NFHsc6vXbsThqZYcVf4iyNToNv9oWiUKLzKt2eJ-YjrGY7uTeHLkg-cwjdPJMUSyILs4VZaYGw6ywAxEPxdhPQeDnBelgofyJtGGnEHqGqN9C1p0RtumVjzjeIvDFSxq6IiIN2-gG55cB4EY', 'Tiện ích ngoại khu dự án Khu đô thị du lịch sinh thái Hạ Long Star: Cách bến xe Bãi Cháy 1 km, cách Ga tàu điện 1.5 km, cách bệnh viện Bãi Cháy 1 km, cách khu du lịch thương mại sinh thái Carina Hạ Long 2 km, cách Công viên sinh thái Đại Dương – cáp treo 3 km, cách Khu nghỉ dưỡng cao cấp Vinpearl đảo rều 3 km, cách đảo Tuần Châu 4 km, cách bệnh viện phụ sản 5 km, cách trung tâm hành chính Hạ Long 5 km, cách bệnh viện quốc tế Vinmec 5 km, cách Sân golf FLC Hạ Long 5 km.', 'Thông tin dự án Hạ Long Star Quảng Ninh', 'Dự án Khu đô thị du lịch sinh thái Hạ Long Star do Công ty Limitless World và Tập đoàn Nakheel (Dubai) làm chủ đầu tư, Tổng công ty tư vấn xây dựng Việt Nam - CTCP (VNCC) làm đơn vị thiết kế.', 'Công ty Limitless World thành lập ngày 23/01/2003, có trụ sở chính tại đường Hậu Cần, phường Bãi Cháy, thành phố Hạ Long, tỉnh Quảng Ninh. Công ty do bà Nguyễn Thị Thu làm người đại diện pháp luật, hoạt động chính trong các lĩnh vực kinh doanh bất động sản, quyền sử dụng đất thuộc chủ sở hữu, chủ sử dụng hoặc đi thuê, tư vấn, môi giới, đấu giá bất động sản, đấu giá quyền sử dụng đất.', 'Tập đoàn Nakheel (Dubai) thành lập ngày 31/10/2006, có trụ sở chính tại số 40, đường Ngô Gia Tự, phường Đức Giang, quận Long Biên, thành phố Hà Nội. Công ty do ông Chu Lê Vương Định làm người đại diện pháp luật, hoạt động chính trong các lĩnh vực dịch vụ lưu trú ngắn ngày.', 'Tháng 6/2014, dự án được UBND tỉnh Quảng Ninh cấp Giấy chứng nhận đầu tư thay đổi lần thứ 8 cho Công ty TNHH Limitless World (Việt Nam), trong đó quy định tiến độ dự án. Sau đó đến tháng 5/2019, dự án thêm một lần nữa được điều chỉnh tiến độ khi Sở Kế hoạch và Đầu tư cấp Giấy chứng nhận đầu tư thay đổi lần thứ 9 cho Limitless World.', 'Thông tin nhanh dự án Hạ Long Star Quảng Ninh', 'Dự án: Hạ Long Star Quảng Ninh', 'Tổng diện tích: 125 ha', 'Vị trí: Phường Bãi Cháy, thành phố Hạ Long, tỉnh Quảng Ninh', 'Tổng vốn đầu tư: 550 triệu USD', 'Loại hình: Shophouse, nhà phố, biệt thự', 'Ngày khởi công:\xa0', 'Chủ đầu tư: Công ty Limitless World và Tập đoàn Nakheel (Dubai)', 'Năm hoàn thành:\xa0', '  Quốc Tấn  ']"
29,tai-quang-ninh,HP Naia City Móng Cái: Dự án khu đô thị thương mại và giải trí tại tỉnh Quảng Ninh ,https://cafeland.vn/du-an/hp-naia-city-mong-cai-du-an-khu-do-thi-thuong-mai-va-giai-tri-tai-tinh-quang-ninh-3574.html,"['Quy mô dự án HP Naia City Móng Cái Quảng Ninh', 'https://static1.cafeland.vn/cafelandnew/tgIeBIuLHbGcTL0XYUHrUNn7v5_5Ys6n42hK3WU0RG0knI2a1FLbj1AlNrYYfzF2g9Vt4gqnO_PNE3B3fn6sh5FjsTk8A-zRSjWY9CxZEtUlObx19FnQvQXUbo11w1JtfNTk25y_0AanyPf4O-mOXfY', 'Dự án Khu đô thị HP Naia City Móng Cái có tổng diện tích 54,8 ha (giai đoạn 1 có diện tích 43,8 ha); diện tích đất ở 105.727,5 m2; đất thương mại dịch vụ 21.936,3 m2; đất giao thông, hạ tầng kỹ thuật 311.141,2 m2; mật độ xây dựng 75% - 80%.\xa0Dự án Khu đô thị HP Naia City Móng Cái phát triển với các loại hình căn hộ khách sạn, casino, shophouse, nhà liền kề và biệt thự đơn lập.', 'https://static1.cafeland.vn/cafelandnew/IGg__SsfeIbllFgr23PZsCJXbAqUvHkhmcA720dKJuci_hy5coFGWiuK0fYw_mkY5FbdoDeugJGK-nP1a5AJOyNyp5fi3DOsdEaSeC1XGE893Aflvd0u2EWK0ZiXmLtEzRtRATakSClYxPxJohFQLAA', 'Khu đô thị HP Naia City Móng Cái xây dựng với 3 phân khu: Hoa Anh Thảo (Primrose), Thu Hải Đường (Begonia) và Hoa Thủy Tiên (Iris). Dự án HP Naia City Móng Cái có quy mô xây dựng gồm\xa035 căn biệt thự đơn lập diện tích từ 300 m2 - 475 m2, xây dựng cao 3 tầng; xây dựng nhà liền kề 375 căn, diện tích từ 102 m2 - 114 m2 và 372 căn shophouse.', 'https://static1.cafeland.vn/cafelandnew/hinh-anh/2022/08/04/194/image.png?t=1', 'Tiện ích nội khu dự án Khu đô thị HP Naia City Móng Cái: Hồ điều hòa, công viên cây xanh, trung tâm thương mại hiện đại, casino, phòng tập gym, nhà hàng, trường học, nhà sinh hoạt cộng đồng, sân bóng, sân tennis, bãi đỗ xe.', 'https://static1.cafeland.vn/cafelandnew/uE0YhXbB9qprbVSxi4aGyg4jjV1-eprspIpjHU7k4azB5c5P6UYlT6k5I8ZtkfvJSbE9Cr4TNESbOCSAlSmloJdLbQUtq7ChVkkQUjkXcJNBwwjRiaDRjBkSakKwDnzpzzRSOIZDzXRELtoVWo8ihoo', 'Tiện ích ngoại khu dự án Khu đô thị HP Naia City Móng Cái: Đến trung tâm thành phố Móng Cái 5 phút di chuyển, chợ trung tâm Móng Cái 8 phút; cửa khẩu quốc tế Móng Cái 10 phút, tới bãi biển Trà Cổ, mũi Sa Vĩ 30 phút.', 'Thông tin dự án HP Naia City Móng Cái Quảng Ninh', 'Dự án Khu đô thị HP Naia City Móng Cái do Công ty cổ phần Đầu tư Hải Phát (Hải Phát Invest) làm chủ đầu tư, HP Real làm đơn vị phân phối.', 'Công ty cổ phần Đầu tư Hải Phát có trụ sở tại tầng 5, tòa CT3, The Pride, khu đô thị mới An Hưng, phường La Khê, quận Hà Đông, thành phố Hà Nội.', 'Công ty cổ phần Đầu tư Hải Phát hoạt động ngày 15/12/2003 do ông Đỗ Quý Hải làm người đại diện pháp luật, công ty hoạt động chính trong các lĩnh vực kinh doanh bất động sản, quyền sử dụng đất thuộc chủ sở hữu, chủ sử dụng hoặc đi thuê, tư vấn, môi giới, đấu giá bất động sản, đấu giá quyền sử dụng đất, dịch vụ lưu trú ngắn ngày…', 'Các sản phẩm tại dự án Khu đô thị HP Naia City Móng Cái có giá bán trên thị trường từ 32 triệu đồng/m2.', 'Thông tin nhanh dự án HP Naia City Móng Cái Quảng Ninh', 'Dự án: HP Naia City Móng Cái', 'Tổng diện tích: 54,8 ha', 'Vị trí: Phường Hải Yên, thành phố Móng Cái, tỉnh Quảng Ninh', 'Tổng vốn đầu tư: 1.154 tỷ đồng', 'Loại hình: Biệt thự, shophouse, nhà ở', 'Ngày khởi công:\xa0', 'Chủ đầu tư: Công ty cổ phần Đầu tư Hải Phát (Hải Phát Invest)', 'Năm hoàn thành: Năm 2023', '  Quốc Tấn  ']"
30,tai-quang-ninh,Marina Bayfront Towers: Dự án chung cư tổ hợp thương mại tại Hạ Long,https://cafeland.vn/du-an/marina-bayfront-towers-du-an-chung-cu-to-hop-thuong-mai-tai-ha-long-3570.html,"['Quy mô dự án Marina Bayfront Towers Hạ Long', 'https://static1.cafeland.vn/cafelandnew/1lsfSLYXHhMWrq8ClE0bOouDUC-VxZTi6-9dFX4aaYDx79x6-EYCBTtZaKNeMlWbZgm-Cr-DFgrnlNMPubjmFIrmWXQ46v8oNL_3VKIRI6FhFxBQgwknXEQbIJZPVEP5nC1H0qIpb2WLeQ16TtX_Okc', 'Dự án Chung cư tổ hợp thương mại Marina Bayfront Towers có tổng diện tích 10 ha, quy mô 2.300 căn hộ được xây dựng với 2 tòa nhà Marina A và Marina B nối tiếp nhau, khoảng cách 2 tòa 100 m, cao 38 tầng.\xa0', 'Tòa chung cư Marina Bayfront Towers xây dựng từ tầng 1 đến tầng 4 là shophouse khối đế, tầng 5 trở lên là căn hộ chung cư, các sản phẩm penthouse và căn hộ có thiết kế 1 đến 3 phòng ngủ có diện tích đa dạng từ 36 m2 - 56 m2 - 72 m2 - 160 m2.', 'https://static1.cafeland.vn/cafelandnew/hinh-anh/2022/08/03/194/image.png?t=1', 'Tiện ích nội khu dự án Chung cư tổ hợp thương mại Marina Bayfront Towers: Bể bơi 4 mùa, bể bơi vô cực, sky bar, rooftop, khu vui chơi trẻ em, trung tâm thương mại, cafe, Bar, nhà hàng Ý…', 'https://static1.cafeland.vn/cafelandnew/Thq60DhidSNHCamB2X3QxfGSAAi1VG8wwRhb6pWHou3B4c90DVjUbby5N40WXJ3tXTIHgKQGjs-PcLPN3El-DnWcrWQHN3l1IfL1952XwJ72mINZgW4ia1V_FVv42FWVc5IHMGRVy4AsNMWNUMYs5kM', 'Tiện ích ngoại khu dự án Chung cư tổ hợp thương mại Marina Bayfront Towers cách rạp chiếu phim CGV và khu vui chơi trẻ em 100 m, khu ẩm thực 200 m, chợ đêm Hạ Long 300 m, bãi biển nhân tạo và bể tạo sóng khổng lồ 300 m, trường học quốc tế Singapore (SIS) 1 km.', 'Thông tin dự án Marina Bayfront Towers Hạ Long', 'Dự án Chung cư tổ hợp thương mại Marina Bayfront Towers do Công ty Cổ phần Tập đoàn Bim (Bim Group) làm chủ đầu tư, công ty có trụ sở tại tầng 1, toà nhà Green bay, đường Hoàng Quốc Việt, phường Hùng Thắng, thành phố Hạ Long, tỉnh Quảng Ninh.', 'Công ty Cổ phần Tập đoàn Bim (Bim Group) hoạt động ngày 05/07/2018 do ông Đoàn Quốc Huy làm người đại diện pháp luật, công ty hoạt động chính trong các lĩnh vực kinh doanh bất động sản, quyền sử dụng đất thuộc chủ sở hữu, chủ sử dụng hoặc đi thuê, tư vấn, môi giới, đấu giá bất động sản, đấu giá quyền sử dụng đất, đại lý du lịch…', 'Chung cư tổ hợp thương mại Marina Bayfront Towers dự kiến khởi công quý 4 năm 2022.\xa0', 'Các sản phẩm căn hộ tại dự án Marina Bayfront Towers có giá bán dự kiến từ 12 triệu đồng/m2.', 'Thông tin nhanh dự án Marina Bayfront Towers Hạ Long', 'Dự án: Marina Bayfront Towers Hạ Long', 'Tổng diện tích: 10 ha', 'Vị trí: Bán đảo 3 thuộc khu đô thị Hạ Long Marina, phường Bãi Cháy, thành phố Hạ Long, tỉnh Quảng Ninh', 'Tổng vốn đầu tư:\xa0', 'Loại hình: Căn hộ, shophouse', 'Ngày khởi công:\xa0', 'Chủ đầu tư: Công ty Cổ phần Tập đoàn Bim (Bim Group)', 'Năm hoàn thành: Quý 3/2024', '  Quốc Tấn  ']"
31,tai-quang-ninh,DMC Plaza: Dự án trung tâm thương mại và căn hộ tại Tp. Hạ Long ,https://cafeland.vn/du-an/dmc-plaza-du-an-trung-tam-thuong-mai-va-can-ho-tai-tp-ha-long-3555.html,"['Quy mô dự án DMC Plaza Hạ Long', 'https://static1.cafeland.vn/cafelandnew/O5yOud5hUz-9s4UjX-Q7QqjNpcCrMPKH8SJ713rt7aBLxdWUlWzkB1aBLl_9D5FvU2O1xCqHfTebkT9uKfLBdPlMtIiSwj-HYSwHtAD6fFFWl6lnsSpOYKc-jnJq9g7ZmUTAYUJ7QaqBZS34ow', 'Dự án Trung tâm thương mại và căn hộ DMC Plaza Hạ Long có tổng diện tích 108.000 m2, diện tích xây dựng 23.498 m2; diện tích xây dựng tòa nhà căn hộ 8.700 m2.', 'https://static1.cafeland.vn/cafelandnew/vGSC-jjX9OMtii7cNf0at61FF41a9IJbpyrxcq0pNYcw5HjmGgvsYkLbuz4tQO-LSblYfkVT20cIODzcOqF_ih8S_M0ujV1ppiG-SSH7jsiJ-FXenCoGRUSI3seFZ5nYRsInNhzmkTUJQlTZeQ', 'Phối cảnh mặt bằng dự án DMC Plaza Hạ Long', 'Dự án Trung tâm thương mại và căn hộ DMC Plaza Hạ Long có quy mô 592 căn hộ, xây dựng với tòa tháp cao 30 tầng, 1 tầng mái và 2 tầng hầm. Căn hộ DMC Plaza Hạ Long có diện tích đa dạng từ 42 m2 - 53m2, 66 m2 - 68m2, 75 m2 - 95 m2, 115 m2 - 130 m2, 170 m2 - 190 m2, 400 m2 - \xa0430 m2.', 'https://static1.cafeland.vn/cafelandnew/hinh-anh/2022/07/27/194/image-20220727131038-5.jpeg?t=1', 'Mặt bằng căn hộ dự án DMC Plaza Hạ Long', 'https://static1.cafeland.vn/cafelandnew/hinh-anh/2022/07/27/194/image-20220727131038-6.jpeg?t=1', 'Mặt bằng căn hộ dự án DMC Plaza Hạ Long', 'Tiện ích nội khu dự án Trung tâm thương mại và căn hộ DMC Plaza Hạ Long: Quảng trường trung tâm, thư viện cộng đồng, bể bơi ngoài trời, khu vui chơi trẻ em ngoài trời, hệ thống gym, yoga, spa, nhà hàng, cafe, trung tâm thương mại, khu vui chơi, khu thể dục thể thao.', 'https://static1.cafeland.vn/cafelandnew/hinh-anh/2022/07/27/194/image-20220727131038-7.jpeg?t=1', 'Tiện ích ngoại khu dự án Trung tâm thương mại và căn hộ DMC Plaza Hạ Long cách đường ven biển Trần Quốc Nghiễn 180 m; cách quảng Trường 30 - 10 khoảng 900 m về hướng Tây Bắc; cách siêu thị Big C Hạ Long 350 m; bảo tàng và thư viện Quảng Ninh 900 m, cầu Bãi Cháy 4,68 km; cách dự án Hạ Long Ocean Park 6,9 km, khu vui chơi Tuần Châu 12 km.', 'https://static1.cafeland.vn/cafelandnew/hinh-anh/2022/07/27/194/image-20220727131038-8.jpeg?t=1', 'Thông tin dự án DMC Plaza Hạ Long', 'Dự án Trung tâm thương mại và căn hộ DMC Plaza Hạ Long do Công ty Cổ phần Đầu tư Bất động sản Hạ Long (thành viên tập đoàn DMC) làm chủ đầu tư, Công ty Cổ phần Constrexim số 1 (Confitech) làm nhà thầu thi công, PST HongKong làm đơn vị thiết kế.', 'Công ty Cổ phần Đầu tư Bất động sản Hạ Long thành lập ngày 26/01/2010 do ông Nguyễn Hồ Hải làm người đại diện pháp luật, có trụ sở tại tòa nhà DMC Plaza, tổ 3, khu 8, phố Hải Hà, phường Hồng Hải, thành phố Hạ Long, tỉnh Quảng Ninh. Công ty hoạt động chính trong các lĩnh vực kinh doanh bất động sản, quyền sử dụng đất thuộc chủ sở hữu, chủ sử dụng hoặc đi thuê, đại lý du lịch, dịch vụ lưu trú ngắn ngày.', 'Thông tin nhanh dự án DMC Plaza Hạ Long', 'Dự án: DMC Plaza Hạ Long', 'Tổng diện tích: 108.000 m2', 'Vị trí: Tổ 3, khu 8, phố Hải Hà, phường Hồng Hải, thành phố Hạ Long, tỉnh Quảng Ninh', 'Tổng vốn đầu tư: 1.400 tỷ đồng', 'Loại hình: Căn hộ, shophouse', 'Ngày khởi công:\xa0', 'Chủ đầu tư: Công ty Cổ phần Đầu tư Bất động sản Hạ Long', 'Năm hoàn thành: Năm 2023', 'Quốc Tấn ']"
33,tai-quang-ninh,"Green Park Hà Phong: Dự án nhà phố, shophouse tại Quảng Ninh",https://cafeland.vn/du-an/green-park-ha-phong-du-an-nha-pho-shophouse-tai-quang-ninh-3433.html,"['Dự án có phía Đông Bắc tiếp giáp suối Lộ Phong, phía Tây Bắc giáp Công ty Cổ phần đăng kiểm cơ giới đường bộ Quảng Ninh và Quốc lộ 18A, phía Đông Nam tiếp giáp với khu dân cư hiện hữu và phía Tây Nam tiếp giáp với khu dân cư đông đúc.', 'Quy mô dự án Green Park Hà Phong', 'https://static1.cafeland.vn/cafelandnew/hinh-anh/2022/06/14/177/z2596270555174_ab9869d6caf8e8169b66d9b8817ad1d5.jpg?t=1', 'Dự án Green Park Hà Phong được triển khai trên quỹ đất có tổng diện tích lên đến 15.973,98m2.', 'https://static1.cafeland.vn/cafelandnew/hinh-anh/2022/06/14/177/MB_HP_0107-MAX.png?t=1', 'Dự kiến Green Park Hà Phong cung cấp ra thị trường 52 lô đất nhà phố, shophouse với diện tích dao động từ 98,25 – 126,8m2, thiết kế xây dựng 5 tầng, mặt tiền đường 6 – 12m.', 'https://static1.cafeland.vn/cafelandnew/hinh-anh/2022/06/14/177/ttv_haphong_2605_outm2-scaled.jpg?t=1', 'Green Park Hà Phong có tiện ích nội khu gồm: hệ thống công viên cây xanh, khuôn viên dạo bộ, khu thương mại, siêu thị, quán cà phê, khu chăm sóc sắc đẹp, khu vui chơi trẻ em, sân thể thao đa năng, hệ thống an ninh khu vực, bãi đậu xe,…', 'https://static1.cafeland.vn/cafelandnew/hinh-anh/2022/06/14/177/green-park-ha-phong.jpg?t=1', 'https://static1.cafeland.vn/cafelandnew/hinh-anh/2022/06/14/177/z2596270577292_fe7b6e5992453a8ce964bd3623a076b5.jpg?t=1', 'Từ dự án Green Park Hà Phong cư dân dễ dàng di chuyển sang các khu vực lân cận, chẳng hạn: di chuyển đến Trường THCS Minh Khai 350m; cách Công an phường Hà Phong 700m; đến Trạm Y tế Hà Phong 1,0km; cách MM Mega Market 900m; đến Ngân hàng Vietin Bank 1,0km; di chuyển đến Sân bay Quốc tế Vân Đồn khoảng 48km;…', 'Thông tin dự án Green Park Hà Phong', 'Dự án Green Park Hà Phong được đầu tư bởi Công ty Cổ phần Minh Anh, được thành lập vào ngày 23.05.2005, đặt trụ sở chính tại số 490 Nguyễn Văn Cừ, phường Hồng Hà, thành phố Hạ Long, tỉnh Quảng Ninh.', 'Theo giấy phép kinh doanh thay đổi ngày 02.06.2014, doanh nghiêp có vốn điều lệ 6,5 tỷ đồng với 4 thành viên gồm Nguyễn Thị Yên góp 1 tỷ đồng (chiếm 15,38% vốn góp), Nguyễn Chính Nhất góp 400 triệu đồng (chiếm 6,15% vốn góp). Nguyễn Thị Phương góp 2,4 tỷ đồng (chiếm 36,92% vốn góp) và Đào Văn Thành góp 2,7 tỷ đồng (chiếm 41,54% vốn góp), do ông Đào Văn Thành (sinh năm 1969) là người đại diện pháp luật của doanh nghiệp. ', 'Dự án được tư vấn chiến lược và phát triển bởi Công ty Cổ phần Bất động sản Duyên Hải.', 'Giá shophouse, liền kề tại dự án Green Park Hà Phong được tham khảo trên thị trường dự án dao động ở mức từ 52 – 57 triệu/m2. ', 'Thông tin nhanh dự án Green Park Hà Phong ', 'Dự án:\xa0Green Park Hà Phong', 'Vị trí: Phường Hà Phong, thành phố Hạ Long, tỉnh Quảng Ninh', 'Loại hình:\xa0Shophouse, liền kề', 'Chủ đầu tư:\xa0Công ty Cổ phần Minh Anh', '  Hòa Bình  ']"
34,tai-quang-ninh,Kings Town: Khu đô thị mới Hạ Long,https://cafeland.vn/du-an/kings-town-khu-do-thi-moi-ha-long-3404.html,"['Quy mô dự án Kings Town Hạ Long', 'https://static1.cafeland.vn/cafelandnew/hinh-anh/2022/06/03/194/image-20220603171036-1.jpeg?t=1', 'Dự án Kings Town Hạ Long có tổng diện tích 185.913 m2, diện tích đất xây dựng nhà phố 11.303,50; tổng diện tích sàn xây dựng 24.664,39 m2; diện tích xây dựng 8.445,34 m2; diện tích cây xanh 1.343,00 m2; diện tích hạ tầng 3.790,50; mật độ xây dựng 51,30%; tỷ lệ sử dụng đất 1,5 lần. Được chia thành 3 giai đoạn:\xa0', 'Giai đoạn 1: Có tổng diện tích 16.437 m2, xây dựng 83 căn Shophouse và 64 căn Townhouse, được thiết thế 3 tầng có diện tích trung bình từ 70 m2/ căn.', 'Giai đoạn 2: Có tổng diện tích 13,196 m2, mật độ xây dựng 40,3%. Xây dựng Chung cư thương mại The Dragon Castle với số lượng 1288 căn, thiết kế 25 tầng nổi, 2 tầng hầm; diện tích căn hộ từ 43,28 m2 – 90,95 m2.', 'Giai đoạn 3: Trung tâm thương mại và văn phòng cho thuê.', 'https://static1.cafeland.vn/cafelandnew/hinh-anh/2022/06/03/194/image-20220603171037-2.png?t=1', 'Tiện ích nội khu: Khu trung tâm thương mại; khu sinh hoạt cộng đồng và hệ thống trường học, mẫu giáo; Club house, bể bơi, spa, fitness; công viên cây xanh.', 'Tiện ích ngoại khu: Dự án Kings Town Hạ Long kết nối tới Khu du lịch Bãi Cháy, đảo Tuần Châu 10 phút; Công viên Sun World Hạ Long của SunGroup, Hạ Long Marine Plaza của Bim Group 10 phút; Khu đô thị cao cấp Vinhomes Dragon Bay, Vincom 10 phút; Bệnh viện Vinmec 15 phút Cảng biển quốc tế Cái Lân; Bến xe Bãi Cháy 5 phút.', 'Thông tin dự án Kings Town Hạ Long', 'Dự án Kings Town Hạ Long do Công ty Tổ chức Nhà Quốc gia (N.H.O JSC) làm chủ đầu tư, có trụ sở chính tại tầng 19, khu văn phòng, tòa nhà Indochina Park Tower, số 04 Nguyễn Đình Chiểu, phường Đa Kao, quận 1, thành phố Hồ Chí Minh.', 'Công ty thành lập ngày 6/9/2012 do ông Kim Kyoo Chul làm người đại diện, hoạt động chính trong các lĩnh vực Kinh doanh bất động sản, quyền sử dụng đất thuộc chủ sở hữu, chủ sử dụng hoặc đi thuê.', 'Công ty Cổ phần Tổ chức Nhà Quốc Gia (N.H.O JSC) được sáng lập từ các nhà đầu tư đến từ Hàn Quốc, Singapore và Việt Nam. ', 'Các sản phẩm căn hộ tại dự án Kings Town Hạ Long có giá bán trên thị trường từ 2,4 tỷ đồng/ căn nhà 3 tầng đã xây xong.', 'Thông tin nhanh dự án Kings Town Hạ Long', 'Dự án: Kings Town Hạ Long', 'Tổng diện tích: 185.913 m2', 'Vị trí: Đường quốc lộ 18, phường Bãi Cháy, thành phố Hạ Long, tỉnh Quảng Ninh', 'Tổng vốn đầu tư:', 'Loại hình: Shophouse, Chung cư thương mại', 'Ngày khởi công: 2017', 'Chủ đầu tư: Công ty Cổ phần Tổ chức Nhà Quốc Gia (N.H.O JSC)', 'Năm hoàn thành: 2019', '  Quốc Tấn  ']"
