,tinh,project,link,content
0,tai-quang-ninh,Crystal Holidays Harbour Van Don: Dự án khu nghỉ dưỡng tại Quảng Ninh,https://cafeland.vn/du-an/crystal-holidays-harbour-van-don-du-an-khu-nghi-duong-tai-quang-ninh-4332.html,"['Quy mô dự án Khu nghỉ dưỡng Crystal Holidays Harbour Van Don Quảng Ninh', 'https://static1.cafeland.vn/cafelandnew/hinh-anh/2024/04/24/195/image-20240424153129-6.jpeg?t=1', 'Phối cảnh Khu nghỉ dưỡng Crystal Holidays Harbour Van Don. ', 'Khu nghỉ dưỡng Crystal Holidays Harbour Van Don được triển khai trên khu đất rộng hơn 2,6ha với mật độ xây dựng 58,2%. ', 'Quy mô dự án gồm 5 tòa tháp ký hiệu A – The Victory, B – The Oasis, C – The Harmony, D – Liberty và E – Heritage cao 28-34 tầng. Trong đó tòa E là tòa khách sạn 5 sao, 4 tòa còn lại là căn hộ.', 'Dự án cung cấp ra thị trường 367 phòng khách sạn, 1.907 căn hộ nghỉ dưỡng với tổng vốn đầu tư 3.611,5 tỷ đồng. Ngoài ra dự án còn có 1 tòa Trung tâm Hội nghị Quốc tế với 1.500 chỗ.', 'https://static1.cafeland.vn/cafelandnew/hinh-anh/2024/04/24/195/image-20240424153129-7.jpeg?t=1', 'Mặt bằng ', 'Dự án được tích hợp 102 tiện ích thiên nhiên và nhân tạo như Nhà hàng ẩm thực theo phong cách Á - Âu, night bar, gambling club, sky bar, cigar lounge, bể bơi vô cực, bể bơi bốn mùa, spa trị liệu cao cấp, rạp chiếu phim 11D.... ', 'https://static1.cafeland.vn/cafelandnew/hinh-anh/2024/04/24/195/image-20240424153129-8.jpeg?t=1', 'Phối cảnh tiện ích Khu nghỉ dưỡng Crystal Holidays Harbour Van Don. ', 'Bên cạnh đó, Crystal Holidays Harbour Van Don còn mang đến những trải nghiệm độc đáo, mới lạ cho du khách, như ngắm vịnh bằng trực thăng du lịch, du ngoạn trên những du thuyền 5 sao, đánh golf trên biển, lặn ngắm san hô dưới đáy biển, trekking trong những khu rừng nguyên sinh trên đảo và nhiều trò chơi thú vị khác...', 'Thông tin dự án Khu nghỉ dưỡng Crystal Holidays Harbour Van Don Quảng Ninh', 'Crystal Holidays Harbour Van Don là dự án khu nghỉ dưỡng do Công ty Cổ phần Everland Vân Đồn làm chủ đầu tư, Công ty TNHH MTV Du lịch Mai Quyền là đơn vị phát triển và được thi công bởi Delta Group.', 'Công ty Cổ phần Everland Vân Đồn được thành lập vào ngày 22/4/2019, với vốn điều lệ ban đầu 350 tỉ đồng. Ông Lê Đình Vinh – Chủ tịch HĐQT Everland Group (EVG)\xa0là người đại diện phần vốn góp 210 tỉ đồng (tương đương tỉ lệ sở hữu 60%) của EVG tại Everland Vân Đồn. Tại Everland Vân Đồn, ông Vinh giữ chức Phó Chủ tịch HĐQT kiêm Tổng Giám đốc.', 'Tháng 4/2021, HĐQT Everland Group đã thông qua chủ trương tăng vốn điều lệ tại Everland Vân Đồn. Theo đó, Everland Vân Đồn phát hành 40 triệu cổ phiếu, mệnh giá 10.000 đồng/cp, trong đó Everland Group có quyền mua 24 triệu cổ phiếu với tổng giá trị 240 tỉ đồng để giữ tỉ lệ sở hữu 60% tại Everland Vân Đồn.', 'Crystal Holidays Harbour Van Don có vị trí tại Lô M1, Khu đô thị du lịch và bến cảng cao cấp Ao Tiên đã được UBND tỉnh Quảng Ninh phê duyệt điều chỉnh quy hoạch chi tiết xây dựng tỉ lệ 1/500 tại Quyết định số 68/QĐ-UBND ngày 8/1/2019.', 'Ngày 23/4/2019, CTCP Everland Vân Đồn và Công ty TNHH MTV Du lịch Mai Quyền đã tổ chức lễ động thổ dự án Crystal Holidays Harbour Van Don, ', 'Ngày 30/4/2022, dự án chính thức khởi công, dự kiến hoàn thành và đi vào hoạt động vào năm 2024.', 'Theo cập nhật tiến độ chủ đầu tư trong tháng 3/2024, dự án đã hoàn thành 100% thi công hầm 5 tòa liên thông nhau. Hiện tại đang hoàn thiện nghiệm thu hầm móng 3 khối tòa C,D và E để thi công phần thân.', 'https://static1.cafeland.vn/cafelandnew/hinh-anh/2024/04/24/195/tiendo1.jpg?t=1', 'https://static1.cafeland.vn/cafelandnew/hinh-anh/2024/04/24/195/tiendo2.jpg?t=1', 'Tiến độ dự án Crystal Holidays Harbour Van Don tháng 3/2024. ', 'Khối đế tòa A ( Victory) và tòa B – The Oasis đến tháng 3/2024 đã xây đến tầng 7. Bãi tắm Đảo Crystal Vân Đồn đã hoàn thiện cơ bản. Khối đế tòa C và D đã tiến hành lắp cẩu chuẩn bị cho thi công khối đế.', 'Thông tin nhanh Khu nghỉ dưỡng Crystal Holidays Harbour Van Don Quảng Ninh', 'Dự án: Crystal Holidays Harbour Van Don', 'Tổng diện tích: 2,6ha', 'Vị trí: Lô M1, Khu đô thị du lịch và bến cảng cao cấp Ao Tiên, xã Hạ Long, huyện Vân Đồn, tỉnh Quảng Ninh', 'Tổng vốn đầu tư:\xa03.611,5 tỷ đồng', 'Loại hình: căn hộ khách sạn', 'Năm khởi công: 30/4/2022', 'Chủ đầu tư: Công ty Cổ phần Everland Vân Đồn', 'Năm hoàn thành: ', '  Trần Thùy  ']"
1,tai-quang-ninh,Lagoon Residences: Dự án phân khu biệt thự cao cấp trong tổ hợp Grand Bay tại Hạ Long,https://cafeland.vn/du-an/lagoon-residences-du-an-phan-khu-biet-thu-cao-cap-trong-to-hop-grand-bay-tai-ha-long-4302.html,"['Quy mô dự án Lagoon Residences Hạ Long', 'https://static1.cafeland.vn/cafelandnew/hinh-anh/2023/12/07/209/image-20231207143727-1.jpeg?t=1', 'Phối cảnh phân khu Lagoon Residences Hạ Long', 'Biệt thự Lagoon Residences nằm tiếp giáp bãi tắm rộng 500m của bán đảo 3, tổng diện tích khoảng 7,8 ha, mật độ xây dựng 31%. ', 'https://static1.cafeland.vn/cafelandnew/hinh-anh/2023/12/07/209/image-20231207143727-2.jpeg?t=1', 'Mặt bằng dự án', 'Quy hoạch gồm 48 căn biệt thự hạng sang được sắp xếp quy hoạch theo hình cánh cung vươn ra mặt hồ và mặt biển. Trong đó có 30 căn biệt thự liền kề diện tích từ 180 – 260 m2, cao 3 tầng và 18 căn biệt thự đơn lập diện tích từ 280 – 385 m2, cao 3 tầng. ', 'https://static1.cafeland.vn/cafelandnew/hinh-anh/2023/12/07/209/image-20231207143727-3.jpeg?t=1', 'Biệt thự đơn lập', 'https://static1.cafeland.vn/cafelandnew/hinh-anh/2023/12/07/209/image-20231207143727-4.jpeg?t=1', 'Biệt thự liền kề', 'Từ vị trí Lagoon Hạ Long, cư dân dễ dàng di chuyển đến\xa0bãi tắm Hạ Long Marina Bán đảo 3 chỉ 10m\xa0và khu vui chơi giải trí 20.000 m2 (đã có quy hoạch ) nằm ngay bên cạnh dự án chung cư Citadines Hạ Long. ', 'https://static1.cafeland.vn/cafelandnew/hinh-anh/2023/12/07/209/image-20231207143727-5.jpeg?t=1', 'Vị trí Lagoon Residences', 'Ngoài sở hữu toàn bộ mặt biển Vịnh Hạ Long – Di sản Hạ Long, khách hàng dễ dàng di chuyển đến các điểm vui chơi giải trí, du lịch tại Bãi Cháy, Đảo Tuần Châu, Du thuyền ngắm vịnh Hạ Long, Cầu quay mặt trời Sun Wheels.', 'https://static1.cafeland.vn/cafelandnew/hinh-anh/2023/12/07/209/image-20231207143727-6.jpeg?t=1', 'Vị trí dự án', 'Thông tin dự án Lagoon Residences Hạ Long', 'Chủ đầu tư dự án là Tập đoàn BIM Group thành lập từ năm 1994, bao gồm hơn 20 công ty con trực thuộc. Doanh nghiệp kinh doanh chính trên lĩnh vực bất động sản, năng lượng tái tạo, nông nghiệp thực phẩm và dịch vụ tiêu dùng.', 'Giá mở bán dự án vào tháng 12/2023 cụ thể theo đơn giá 175 triệu/m2 – 185tr/m2 (gồm VAT):', 'Thông tin nhanh dự án Lagoon Residences Hạ Long', 'Dự án: Biệt thự Lagoon Residences Hạ Long', 'Tổng diện tích: 7.8 ha', 'Vị trí: Đại lộ Marina Hạ Long, phường Bãi Cháy, thành phố Hạ Long, tỉnh Quảng Ninh', 'Tổng vốn đầu tư:\xa0', 'Loại hình: Biệt thự', 'Năm khởi công: ', 'Chủ đầu tư: Tập đoàn BIM Group', 'Năm hoàn thành: Năm 2023', '  Mỹ Tuyên  ']"
2,tai-quang-ninh,SafaBay: Dự án khu đô thị nghỉ dưỡng tại Cẩm Phả,https://cafeland.vn/du-an/safabay-du-an-khu-do-thi-nghi-duong-tai-cam-pha-4249.html,"['Quy mô dự án SafaBay Cẩm Phả', 'https://static1.cafeland.vn/cafelandnew/hinh-anh/2023/10/30/186/image-20231030153112-1.jpeg?t=1', 'SafaBay là dự án thuộc Khu đô thị Green Dragon City có diện tích gần 99,2 ha. Dự án đô thị nghỉ dưỡng SafaBay có tổng diện tích quy hoạch 39,33 ha, mật độ xây dựng 25%. Dự án được thiết kế xây dựng dòng sản phẩm Fusion Homes với các loại hình biệt thự, liền kề và shophouse.', 'https://static1.cafeland.vn/cafelandnew/hinh-anh/2023/10/30/186/image-20231030153112-2.jpeg?t=1', 'Mặt bằng phân lô dự án SafaBay', '- Biệt thự: Số lượng 141 căn sở hữu diện tích 291 – 1.149 m2, được xây dựng với chiều cao 3 tầng và 1 tum. Mỗi sản phẩm biệt thự thiết kế với 5 phòng ngủ, bể bơi, 2 bể Jacuzzi, phòng sinh hoạt chung, kho và phòng giặt.', 'https://static1.cafeland.vn/cafelandnew/hinh-anh/2023/10/30/186/image-20231030153112-3.png?t=1', 'Thiết kế biệt thự tại SafaBay', '- Shophouse: Số lượng 610 căn với diện tích từ 114 – 351 m2, chiều cao xây dựng 5 tầng (sản phẩm xây sẵn và sản phẩm đất nền). Mỗi căn shophouse được thiết kế với 1 khu vực shop, 2 phòng studio, 6 phòng ngủ, bể bơi và phòng đa năng.', 'https://static1.cafeland.vn/cafelandnew/hinh-anh/2023/10/30/186/image-20231030153112-7.png?t=1', 'Thiết kế shophouse tại SafaBay', '- Liền kề: Sở hữu số lượng 122 căn, diện tích 93,5 – 293 m2, được trải dài trên các tuyến đường nội khu và phố đi bộ.', 'Tại dự án đô thị nghỉ dưỡng SafaBay, cư dân được thừa hưởng hệ thống tiện ích nội khu với các hạng mục bao gồm: Bãi biển, quán bar bãi biển và khu vui chơi trên cát, điểm checkin hòn Trống Mái, cầu cảng và bến du thuyền, phố đi bộ Rồng Xanh, vườn cảnh quan, công viên khinh khí cầu, công viên phao nổi, bãi đỗ xe…', 'https://static1.cafeland.vn/cafelandnew/hinh-anh/2023/10/30/186/image-20231030153112-12.jpeg?t=1', 'Tiện ích tại dự án SafaBay', 'Bên cạnh đó, từ dự án có thể tiếp cận được hệ thống tiện ích ngoại khu trong khu vực thành phố Cẩm Phả như: Chợ hải sản Bến Do, Vincom Plaza Cẩm Phả, sân vận động thành phố Cẩm Phả, quảng trường 12/11, công an thành phố Cẩm Phả, công viên thành phố Cẩm Phả, suối khoáng nóng địa chất Km4, khu đô thị Cẩm Đông Ocean Park, bến tàu Vũng Đục….', 'Thông tin dự án SafaBay Cẩm Phả', 'Chủ đầu tư dự án đô thị du lịch SafaBay Cẩm Phả là Công ty Cổ phần Tập đoàn Đầu tư Phát triển Công nghiệp TTP (Tập đoàn TTP), đơn vị phát triển dự án PTC Land, đơn vị phát triển kinh doanh BHS Group.', 'Theo tìm hiểu, dự án Khu đô thị Green Dragon City có tên pháp lý là Khu đô thị - du lịch, dịch vụ Bái Tử Long I (SafaBay là giai đoạn 1). Dự án được UBND tỉnh Quảng Ninh ban hành quyết định số 539/QĐ-UBND ngày 01/02/2019 về việc giao đất cho Tập đoàn TTP để thực hiện dự án.', 'Ngày 16/09/2023 đơn vị phát triển dự án đã ký kết cùng BHS Group hợp tác phát triển chiến lược dự án.', 'Đến ngày 25/10/2023, chủ đầu tư cùng các đơn vị phát triển tổ chức lễ ra mắt dòng sản phẩm mới và trải nghiệm các tiện ích dự án Safabay.', 'Thông tin nhanh dự án SafaBay Cẩm Phả', 'Dự án: SafaBay Cẩm Phả', 'Tổng diện tích: 39,33 ha', 'Vị trí: Đường bao biển Hạ Long -\xa0 Cẩm Phả, thuộc 3 phường Cẩm Bình – Cẩm Trung – Cẩm Thành, thành phố Cẩm Phả, tỉnh Quảng Ninh', 'Tổng vốn đầu tư: ', 'Loại hình: Biệt thự, shophouse, liền kề', 'Năm khởi công: ', 'Chủ đầu tư: Công ty Cổ phần Tập đoàn Đầu tư Phát triển Công nghiệp TTP', 'Năm hoàn thành: ', '  Mạnh Dũng  ']"
3,tai-quang-ninh,Núi Hạm: Dự án khu đô thị mới tại Hạ Long,https://cafeland.vn/du-an/nui-ham-du-an-khu-do-thi-moi-tai-ha-long-4183.html,"['Quy mô dự án Núi Hạm Hạ Long', 'https://static1.cafeland.vn/cafelandnew/hinh-anh/2023/09/16/186/image-20230916105726-1.jpeg?t=1', 'Khu đô thị mới Núi Hạm Hạ Long có tổng diện tích quy hoạch rộng 60,89 ha, bao gồm hạng mục đất ở có diện tích 139.958 m2 với nhà liền kề 38.781 m2; biệt thự 66.956 m2; công trình nhà ở hỗn hợp 21.638 m2, nhà ở xã hội 12.582 m2…', 'https://static1.cafeland.vn/cafelandnew/hinh-anh/2023/09/16/186/image-20230916105726-2.png?t=1', 'Mặt bằng dự án Khu đô thị mới Núi Hạm Hạ Long', 'Dự án sở hữu hệ thống tiện ích nội khu với các hạng mục như: Công viên cây xanh, khu trung tâm thương mại, trường học, bệnh viện, ngân hàng, siêu thị, trung tâm đô thị, khu để xe ngầm…', 'Bên cạnh đó từ dự án Khu đô thị mới Núi Hạm Hạ Long, cư dân có thể tiếp cận hệ thống tiện ích ngoại khu lân cận như: Cách làng chài Hà Phong 3 km, cách trung tâm Hòn Gai 5 km; cách Khu nghỉ dưỡng khoáng nóng Sun Onsen Quang Hanh 10,9 km, cách Sunworld Hạ Long 14 km; cách sân bay quốc tế Vân Đồn 54 km, cách Thủ đô Hà Nội 153 km…', 'Thông tin dự án Núi Hạm Hạ Long', 'Chủ đầu tư dự án Khu đô thị mới Núi Hạm Hạ Long là Công ty Cổ phần Phát triển Đô thị Từ Liêm (LIDECO), được công bố thành lập ngày 20/07/2004, đặt trụ sở tại tòa nhà No9B1, Khu đô thị mới Dịch Vọng, phường Dịch Vọng, quận Cầu Giấy, thành phố Hà Nội.', 'Được biết dự án Khu đô thị mới Núi Hạm Hạ Long được UBND tỉnh Quảng Ninh giao cho LIDECO lập quy hoạch chi tiết 1/500 Khu đô thị mới tại khu vực Núi Hạm, phường Hồng Hà và phường Hà Tu, thành phố Hạ Long theo quyết định số 255/QĐ-UBND ngày 21/01/2019.', 'Đến ngày 28/04/2020, UBND tỉnh Quảng Ninh có quyết định số 1383/QĐ-UBND về việc phê duyệt nhiệm vụ điều chỉnh quy hoạch chi tiết tỷ lệ 1/500 Khu đô thị mới tại khu vực Núi Hạm, phường Hồng Hà và phường Hà Tu, thành phố Hạ Long.', 'Thông tin nhanh dự án Núi Hạm Hạ Long', 'Dự án: Khu đô thị mới Núi Hạm Hạ Long', 'Tổng diện tích: 60,89 ha', 'Vị trí: Phường Hồng Hà và phường Hà Tu, thành phố Hạ Long, tỉnh Quảng Ninh', 'Tổng vốn đầu tư: ', 'Loại hình: Biệt thự, liền kề', 'Năm khởi công: ', 'Chủ đầu tư: Công ty Cổ phần Phát triển Đô thị Từ Liêm (LIDECO)', 'Năm hoàn thành: ', '  Mạnh Dũng  ']"
4,tai-quang-ninh,Ruby City Hạ Long: Dự án khu đô thị tại Quảng Ninh,https://cafeland.vn/du-an/ruby-city-ha-long-du-an-khu-do-thi-tai-quang-ninh-4148.html,"['Quy mô dự án Ruby City Hạ Long', 'https://static1.cafeland.vn/cafelandnew/hinh-anh/2023/08/16/186/image-20230816154201-1.jpeg?t=1', 'Ruby City Hạ Long có tổng diện tích quy hoạch 9,8, mật độ xây dựng 26,5%. Dự án được phân thành các hạng mục xây dựng bao gồm: Đất nền nhà liền kề 28.431 m2; đất chung cư 4.781 m2; đất giao thông, vỉa hè 37.596 m2; đất vườn treo 21.631 m2; phần còn lại dành cho đất công cộng và cây xanh.', 'https://static1.cafeland.vn/cafelandnew/hinh-anh/2023/08/16/186/image-20230816154201-2.jpeg?t=1', 'Mặt bằng dự án Ruby City Hạ Long', 'Dự án Ruby City Hạ Long cung cấp ra thị trường 307 sản phẩm liền kề có diện tích từ 58,5 – 165 m2 và 2 block căn hộ chung cư cao 11 tầng. Cùng hệ thống tuyến đường nội khu rộng từ 17,5 m, 19 m, 20,5 m thuận tiện cho việc lưu thông.', 'Cư dân tại dự án Ruby City Hạ Long được thừa hưởng hệ thống tiện ích nội khu bao gồm: Công viên cây xanh khu sinh hoạt cộng đồng, bãi đỗ xe, khách sạn, văn phòng, hệ thống trường học và nhà văn hóa…', 'https://static1.cafeland.vn/cafelandnew/hinh-anh/2023/08/16/186/image-20230816154201-3.jpeg?t=1', 'Phối cảnh dự án Ruby City Hạ Long', 'Từ dự án, thuận tiện di chuyển đến các khu vực lân cận như: Cách FLC Tropical City 600 m, cách hệ thống trường mầm non 1,5 km; cách trường TH Đoàn Thị Điểm 3 km, cách tòa án nhân dân tỉnh Quảng Ninh 3 km, cách FLC Hạ Long 5 km, cách ngã tư Loong Tòng 4 km, cách cao tốc Hà Nội – Hạ long 5 km, cách cầu Bãi Cháy 6 km…', 'https://static1.cafeland.vn/cafelandnew/hinh-anh/2023/08/16/186/image-20230816154201-4.jpeg?t=1', 'Thông tin dự án Ruby City Hạ Long', 'Chủ đầu tư dự án Ruby City Hạ Long là Công ty Cổ phần Đầu tư Xây dựng và Thương mại Tân Thành được thành lập ngày 17/05/2007, đặt trụ sở tại số 490 Nguyễn Văn Cừ, phường Hồng Hà, thành phố Hạ Long, tỉnh Quảng Ninh.', 'Các sản phẩm đất liền kề tại dự án có mức giá tham khảo trên thị trường từ 13,5 - 17 triệu đồng/m2.', 'Thông tin nhanh dự án Ruby City Hạ Long', 'Dự án: Ruby City Hạ Long', 'Tổng diện tích: 9,8 ha', 'Vị trí: Đường Trần Phú, phường Hà Khánh, thành phố Hạ Long, tỉnh Quảng Ninh', 'Tổng vốn đầu tư: ', 'Loại hình: Đất nền', 'Năm khởi công: ', 'Chủ đầu tư: Công ty Cổ phần Đầu tư Xây dựng và Thương mại Tân Thành', 'Năm hoàn thành: ', '  Mạnh Dũng  ']"
5,tai-quang-ninh,Ban Mai Villas: Dự án biệt thự tại Hạ Long,https://cafeland.vn/du-an/ban-mai-villas-du-an-biet-thu-tai-ha-long-4131.html,"['Quy mô dự án Ban Mai Villas Hạ Long', 'https://static1.cafeland.vn/cafelandnew/hinh-anh/2023/07/29/186/image-20230729111758-1.jpeg?t=1', 'Ban Mai Villas có tổng diện tích quy hoạch 17,3 ha, mật độ xây dựng 40%. Dự án được thiết kế xây dựng với mô hình đất nền liền kề và đất nền biệt thự với chiều cao xây dựng tối đa 4 tầng.', 'https://static1.cafeland.vn/cafelandnew/hinh-anh/2023/07/29/186/image-20230729111758-2.jpeg?t=1', 'Mặt bằng phân lô dự án Ban Mai Villas', 'Được định hướng phát triển theo mô hình khu đô thị compound khép kín, dự án Ban Mai Villas sở hữu hệ thống tiện ích nội khu với các hạng mục bao gồm: Hồ bơi, khu trung tâm thể thao, nhà hàng – khách sạn, hệ thống văn phòng, trường mầm non...', 'Từ dự án, cư dân có thể tiếp cận được hệ thống tiện ích ngoại khu lân cận như: Cách chợ Bãi Cháy 500 m, cách tổ hợp du lịch Sun World Hạ Long Park chỉ 1 km, cách cầu Bãi Cháy 1,5 km, cách bệnh viện Bãi Cháp 3 km, cách vịnh cửa Lục 3,6 km, cách bện viện Vinmec 6 km, cách bảo tàng Quảng Ninh 7 km, cách đảo Tuần Châu 14 km…', 'Thông tin dự án Ban Mai Villas Hạ Long', 'Chủ đầu tư dự án Ban Mai Villas Hạ Long là Công ty Cổ phần Thương mại và Đầu tư Ban Mai được thành lập ngày 01/09/2006, đặt trụ sở tại khu 4, phường Bãi Cháy, thành phố Hạ Long, tỉnh Quảng Ninh.', 'Các sản phẩm tại dự án Ban Mai Villas có mức giá ban tham khảo từ 18 triệu đồng/m2.', 'Thông tin nhanh dự án Ban Mai Villas Hạ Long', 'Dự án: Ban Mai Villas Hạ Long', 'Tổng diện tích: 17,3 ha', 'Vị trí: Đường Hải Quân phường Bãi Cháy, thành phố Hạ Long, tỉnh Quảng Ninh', 'Tổng vốn đầu tư: ', 'Loại hình: Đất nền', 'Năm khởi công: ', 'Chủ đầu tư: Công ty Cổ phần Thương mại và Đầu tư Ban Mai', 'Năm hoàn thành: ', '  Mạnh Dũng  ']"
8,tai-quang-ninh,Grand Bay Halong Villas: Dự án khu dinh thự tại Hạ Long,https://cafeland.vn/du-an/grand-bay-halong-villas-du-an-khu-dinh-thu-tai-ha-long-4088.html,"['Quy mô dự án Grand Bay Halong Villas', 'https://static1.cafeland.vn/cafelandnew/hinh-anh/2023/06/21/186/image-20230621130414-1.jpeg?t=1', 'Khu dinh thự Grand Bay Halong Villas có tổng diện tích 7,8 ha, được thiết kế với mô hình biệt thự theo phong cách miền Nam California với số lượng chỉ 56 căn. Dự án bao gồm các loại hình: Luxury Villa hướng hồ, Luxury Villa hướng vịnh, Luxury Villa hướng công viên, Luxury Villa hướng vườn, Premium Villa.', 'https://static1.cafeland.vn/cafelandnew/hinh-anh/2023/06/21/186/image-20230621130414-2.jpeg?t=1', 'Mặt bằng phân lô dự án Grand Bay Halong Villas', 'Luxury Villa hướng hồ: Sở hữu số lượng 9 căn có diện tích đất từ 496 – 723 m2, được xây dựng cao 3 tầng với 5 phòng ngủ. Trong đó diện tích đất sử dụng 240 m2 với tổng diện tích sàn xây dựng 638,5 m2.', 'https://static1.cafeland.vn/cafelandnew/hinh-anh/2023/06/21/186/image-20230621130414-3.png?t=1', 'Thiết kế mẫu Luxury Villa hướng hồ', 'Luxury Villa hướng vịnh: Sở hữu số lượng 8 căn có diện tích đất lớn từ 538 – 1.001 m2, chiều cao xây dựng 3 tầng với 5 phòng ngủ. Mỗi căn có diện tích sử dụng 247 m2 và tổng diện tích sàn 644 m2.', 'https://static1.cafeland.vn/cafelandnew/hinh-anh/2023/06/21/186/image-20230621130414-6.png?t=1', 'Thiết kế Luxury Villa hướng vịnh', 'Luxury Villa hướng công viên: Số lượng chỉ 3 căn có diện tích đất từ 627 – 711 m2, chiều cao xây dựng 3 tầng với 5 phòng ngủ. Diện tích đất sử dụng mỗi căn là 240 m2 với\xa0 638,5 m2 diện tích sàn.', 'https://static1.cafeland.vn/cafelandnew/hinh-anh/2023/06/21/186/image-20230621130414-9.png?t=1', 'Thiết kế Luxury Villa hướng công viên', 'Luxury Villa hướng vườn: Số lượng 16 căn diện tích đất từ 535 – 706 m2, chiều cao xây dựng 3 tầng với 5 phòng ngủ. Diện tích xây dựng 240 m2 với tổng diện tích sàn 638,5 m2.', 'https://static1.cafeland.vn/cafelandnew/hinh-anh/2023/06/21/186/image-20230621130414-12.png?t=1', 'Thiết kế Luxury Villa hướng vườn', 'Premium Villa mẫu 1: Số lượng 17 căn có diện tích đất từ 301 – 332 m2, chiều cao xây dựng 3 tầng, sở hữu 3 phòng ngủ với tổng diện tích sàn 427.5 m2.', 'https://static1.cafeland.vn/cafelandnew/hinh-anh/2023/06/21/186/image-20230621130414-15.png?t=1', 'Thiết kế Premium Villa mẫu 1', 'Premium Villa mẫu 2: Số lượng chỉ 3 căn có diện tích đất từ 399 – 465 m2, chiều cao xây dựng 3 tầng với 4 phòng ngủ. Mỗi căn có tổng diện tích sàn 433 m2 và diện tích bể bơi 35,5 m2.', 'https://static1.cafeland.vn/cafelandnew/hinh-anh/2023/06/21/186/image-20230621130414-18.png?t=1', 'Thiết kế Premium Villa mẫu 2', 'Tại dự án Grand Bay Halong Villas, cư dân có thể thừa hưởng những tiện ích nội khu như: Sân chơi trẻ em, sân fitness ngoài trời, sân bóng rổ, quảng trường cỏ, giàn che nắng hình cánh buồm, khu BBQ ngoài trời, sân bóng chuyền trên bãi cát, chòi xích đu, club house…', 'https://static1.cafeland.vn/cafelandnew/hinh-anh/2023/06/21/186/image-20230621133451-1.jpeg?t=1', 'Thông tin dự án Grand Bay Halong Villas', 'Chủ đầu tư dự án Grand Bay Halong Villas là Công ty Cổ phần Bất động sản BIM (BIM Land). Ngoài dự án trên BIM Land còn đầu tư và phát triển nhiều dự án khác như Park Hyatt Phu Quoc Residences, Phu Quoc Marina Square, Halong Marina Square, Sailing Club Residences Ha Long Bay, Citadines Marina HaLong…', 'Các sản phẩm tại dự án Grand Bay Halong Villas được ra mắt thị trường từ năm 2022. Các sản phẩm tại dự án có mức giá bán tham khảo trên thị trường từ 118 – 170 triệu đồng/m2, tương đương khoảng 35 – 45 tỷ đồng/căn.\xa0', 'Thông tin nhanh dự án Grand Bay Halong Villas', 'Dự án: Grand Bay Halong Villas', 'Tổng diện tích: 7,8 ha', 'Vị trí: Khu đô thị du lịch Halong Marina, phường Bãi Cháy, thành phố Hạ Long, tỉnh Quảng Ninh', 'Tổng vốn đầu tư: ', 'Loại hình: Biệt thự', 'Năm khởi công: ', 'Chủ đầu tư: Công ty Cổ phần Bất động sản BIM (BIM Land)', 'Năm hoàn thành: ', '  Mạnh Dũng  ']"
